Language,City Name,Hotel Name,Upside_Review,Downside_Review,Review_Score,Sentiment
Chinese,Beijing,天伦松鹤大饭店,位置,酒店房间装修的味道特别大 臭死了 问前台说 他们不了解酒店情况 说都没有上去过自己的酒店 也不知道酒店房间这么臭！触碰的站立灯也是坏的...害怕触电实在无语.....而且在booking预定的时候明明写了有浴缸 结果给我们的房间又臭又没有浴缸 想找酒店负责人说明一下换个房间 结果前台服务人员一直说没有负责人联系方式....更无语了....后来换了三次都很臭 面前住了两晚....九百多两个晚上真的很亏....大家还是别住这个酒店了……,1,NEG
Chinese,Beijing,北京希尔顿酒店,早餐很不错 升级行政可以使用行政下午茶,,10,POS
Chinese,Beijing,北京希尔顿酒店,地點,前台電話很難打通，房間、健身房很髒，前台允諾早餐會由金卡會員招待，但仍然出現在帳單上。,3,NEG
Chinese,Beijing,北京希尔顿酒店,,外卖不让送上楼能理解，毕竟为了住客安全。但是酒店不能帮送上楼吗？不送上楼不能先放在前台吗，非要自己立刻下去拿。隔音很差，走廊里声音一清二楚。不是去使馆办事的话，下次不会住这里了。,6,NEG
Chinese,Beijing,北京希尔顿酒店,地理位置 住宿硬件设施都不错,"15:00入住 15:30都没有拿到钥匙 五一客人多可以理解 但是希望也能安规定时间入住
冰箱里之前客人剩下的半盒菠萝清洁人员都没有收走 味道挺大的
然后就是8-9点吧 外面就开始做清洁了 停吵的",5,NEG
Chinese,Beijing,北京希尔顿酒店,,早餐不丰富，房间垃圾桶太少，茶包没有及时补充,5,NEG
Chinese,Beijing,北京东隅酒店,所有工作工作人員都非常的熱心協助旅客。在疫情嚴峻期間給予支持和協助。,無,10,POS
Chinese,Beijing,北京东隅酒店,大堂看起来还算漂亮,房间面积不大 设施和装潢包括一次性用品非常普通 价格也不低 这个价位可选择的五星级酒店要远比它好 不会再住,4,NEG
Chinese,Beijing,北京东隅酒店,服务还不错，清洁还算到位 ，地理位置优越,设施老化陈旧，不值这个价格,5,NEG
Chinese,Beijing,北京东隅酒店,位置好,房间里有弱电间，隐藏的也不好，门关不严。房间内部的灯光有点暗。,5,NEG
Chinese,Beijing,北京东隅酒店,,隔音太差了！,6,NEG
Chinese,Beijing,北京康莱德酒店,"房间非常宽敞明亮 隔音好 舒适度极高
早餐种类多 带孩子去给了很多礼品 前台 大堂经理都很热情 非常非常满意",,10,POS
Chinese,Beijing,北京康莱德酒店,设施和地理位置还行，但管理系统混乱，前台和门口迎宾缺少基本礼貌，没有礼貌用语，犯错不道歉反而找借口推诿,"1. 付了双早的价格却被告知只有单早，在不核对清楚的情况下说顾客订单问题，差一点付了钱没有饭吃
2. 转天吃早餐时，餐饮部没有准确信息，依然说我们只有单早，说明部门之间存在沟通问题，管理系统极其混乱
3. 出现问题完全没有道歉，要么说不知道原因，要么在解释为什么出错，事实上客户并不需要知道为什么会出错，只需要工作人员解决问题，符合大家对五星级酒店服务的期待，毕竟咱们收了服务费，要展示出专业，万一出现错误请表示歉意。
4. 我们再次进入酒店时，门口迎宾的反应还不如普通小区的看门大爷，或者旁边商场的门口保安，对我们说“哎，测体温”并一脸鄙夷的感觉，我觉得咱们收了服务费的情况下是不是起码要说一句“麻烦您来这边测一下体温”。疫情期间有相关测温的流程我们完全可以理解并照做，但不希望在一个五星酒店被呼来唤去体会不到基本礼貌对待也请贵酒店理解。
总之，贵酒店硬件再好也弥补不了感受极差这种体验，我们质疑是不是整个希尔顿酒店系列缺乏基本培训和服务意识，整个希尔顿品牌为康莱德的糟糕表现蒙羞。",3,NEG
Chinese,Beijing,北京康莱德酒店,泳池及服务人员还比较好,刚入住时候竟然没有任何行李生帮忙，早餐一般，前台也没有备任何口罩，作为入住酒店的客人，临时需要口罩，直接回答我没义务提供口罩,4,NEG
Chinese,Beijing,北京康莱德酒店,就是為了風景才選擇入住康萊德，景色開揚。,酒店快10個年頭了、設施較舊。馬桶圈一坐下就移位、洗手間燈一閃一閃的，北京酒店通跟前台說了表示會跟進，晚上回來發現根本沒修理。。。 酒店停車沒有免費，6000一晚的房間 真不值。北京又新又好的酒店多著，下次不會再來了。,6,NEG
Chinese,Beijing,北京康莱德酒店,在房间的卫生方面需要再关注细节,,5,NEG
Chinese,Beijing,北京朝阳悠唐皇冠假日酒店,订的大床房，办入住时给升级了高楼层19层行政楼层角房，面积大很多，房间布局合理，谢谢可乐的帮忙,,10,POS
Chinese,Beijing,北京朝阳悠唐皇冠假日酒店,"地点算是方便，但整体装修已经挺陈旧的了，但核心是服务太糟糕……
1，入住时上下来回跑了3次门卡失效，3次！
2，疫情关系入住后自己做了消毒而且短住2天不需要打扫，出门挂了“请勿打扰”的门牌，但服务员连电话都不联系，直接打扫……
3，早上退房赶时间，结完账留下开票信息请前台开完稍后再取，结果晚上去取的时候发票找不到，等待很久重新开……
4，打车离开时大包小包，门口的服务员不帮忙放一下行李……
服务真的让人无语。",服务有待改进，不过看这酒店的架势，估计是国企背景，改善应该是不可能了,4,NEG
Chinese,Beijing,北京朝阳悠唐皇冠假日酒店,"地点算是方便，但整体装修已经挺陈旧的了，但核心是服务太糟糕……
1，入住时上下来回跑了3次门卡失效，3次！
2，疫情关系入住后自己做了消毒而且短住2天不需要打扫，出门挂了“请勿打扰”的门牌，但服务员连电话都不联系，直接打扫……
3，早上退房赶时间，结完账留下开票信息请前台开完稍后再取，结果晚上去取的时候发票找不到，等待很久重新开……
4，打车离开时大包小包，门口的服务员不帮忙放一下行李……
服务真的让人无语。",服务有待改进，不过看这酒店的架势，估计是国企背景，改善应该是不可能了,4,NEG
Chinese,Beijing,北京朝阳悠唐皇冠假日酒店,地點,"設備,附了五星價錢,只有三星的感覺",3,NEG
Chinese,Beijing,北京朝阳悠唐皇冠假日酒店,前台业务办入住和退房都很速度，入住期间电话服务态度也很好～,"淋浴房太可怕了，首先淋雨喷头无法固定到合适的角度，龙头水一打开，就会自动旋转到靠墙的方向对着墙角冲，跟本没法冲到头和身子，全程得拿着花洒才能冲干净。其次，最雷的是，淋浴房下水道几乎是堵住的，然后排不出去的水实际全部沿着淋雨房门流到外面，等我洗完头洗完澡出来，外面整个浴室、门厅地砖上全部都是水，几乎已经流到里面地毯上，水深至少有5厘米，拖鞋全部湿光，简直像游泳池。
后来打电话让服务员来，擦了几十分钟才把水擦干。。。太雷了，实在不敢相信这是IHG下面的皇冠假日。。。",6,NEG
Chinese,Beijing,北平北京站青年旅舍,交通十分方便,,9,POS
Chinese,Beijing,北平北京站青年旅舍,设施什么的都差不多，主要是位置好。,我觉得屋里很潮，我估计也没办法改进，平房也防不住潮。,4,NEG
Chinese,Beijing,北平北京站青年旅舍,地段还行，但位置不好找,夜间到达，接待人员并不太熟练，带错了房间,5,NEG
Chinese,Beijing,北平北京站青年旅舍,卫生很不错，其他就是最基础配置，够用，这个地段性价比还是很好的,房间有点局促，灯光有点弱，主光源是床头灯。隔音是真不好，尤其开关门的时候，夜里巷口垃圾站的震动声很大,6,NEG
Chinese,Beijing,北京中奥马哥孛罗大酒店,整節舒適明亮。,服務人員的態度可再加強。,10,POS
Chinese,Beijing,北京中奥马哥孛罗大酒店,客房舒適 大廳氣派 員工服務親切 有外送櫃方便 位置不錯 房間有體重計,房間有煙味 入住時地毯還有點濕濕的 沒有免治馬桶,6,NEG
Chinese,Beijing,北京中奥马哥孛罗大酒店,位置不错,设施,6,NEG
Chinese,Beijing,北京中奥马哥孛罗大酒店,,設施較陳舊，被褥未清洗乾淨仍有污漬,6,NEG
Chinese,Beijing,北京香格里拉,住的舒适度，完全没问题，非常喜欢这家酒店，每次来北京出差基本都是住这里的，走的时候比较急，遗留了个平板电脑，但联系酒店后，我司机送我到机场回去后，也马上到酒店礼宾部取了回去，谢谢,三年疫情没来，不知道为什么这次来觉得按了上下后，电梯来得比以前慢了很多，不知是否是五一假期住的人多的原因，另外景阁房间太旧了，电源插座好多不能用了（1209房），不知为什么当时不趁疫情时重新装修一下“景阁”。,9,POS
Chinese,Beijing,北京香格里拉,首次用这个平台订酒店，订的时候是含双早的高级大床房（1038元+172服务费）但到店说不含早点费用，周四入住和同等周五入住的费用一样但周五是含双早的，我的订单上并没有任何显示不含早餐，和平台的工作人员联系过，告之没有显示含双早也没有显示不含，最后没有双早。,没有明确订房信息的显示。例：3号入住，订的是含双早餐，但是到酒店告知没有，也查不到相关信息，只能对照下周四的同类房，那为何不对照周五同类房呢，周末房价位不是更高吗？,5,NEG
Chinese,Beijing,北京香格里拉,服务很好！gro里的李荣博很贴心送来银耳羹，FD高小累（我记得是这个名字）赠送了果盘。,酒店设施太陈旧了，门把手应该更新换代了，地理位置略远。,5,NEG
Chinese,Beijing,北京香格里拉,早餐品种多，人也多，地理位置不错,设施陈旧，床头没有电源插座，网速慢,5,NEG
Chinese,Beijing,北京瑰丽酒店,跟老婆在一起五年，这是第二次周年纪念在瑰丽过的。前台接待的同事crystal很贴心，送了小礼品。一次很愉快的入住体验。,暂无。,10,POS
Chinese,Beijing,北京瑰丽酒店,办理入住的人员态度很好,住进去 每次出去再回来 都会被问办入住还是上楼吃饭 呵呵,5,NEG
Chinese,Beijing,北京瑰丽酒店,,员工态度傲慢，自认为是北京人高人一等一颗老鼠屎坏了一锅粥,6,NEG
Chinese,Beijing,北京瑰丽酒店,,人員態度不佳,1,NEG
Chinese,Beijing,北京中关村皇冠假日酒店,特别感谢大堂的礼宾部主管王河峰先生很耐心地帮我解决了创可贴的问题。早餐很丰富,暂时没有。,10,POS
Chinese,Beijing,北京中关村皇冠假日酒店,房間空間足夠,沒有冷風只有自然風的空調！,5,NEG
Chinese,Beijing,北京中关村皇冠假日酒店,地理位置还可以,"卫生间虽然很大，但是布局极其不合理，淋浴间又大又滑，防滑垫只能管一小块地方，从淋浴头走到外面至少需要3大步，这段区域没有任何防滑措施，洗完澡全是水，非常容易滑倒！
酒店和房间都有点陈旧了，酒店的装修风格真的有点土…… 好像80年代风格，不过怎么说呢，皇冠就是这风格吧！",5,NEG
Chinese,Beijing,北京中关村皇冠假日酒店,地址位置还算不错，在两个地铁站中间。离圆明园，颐和园比较近。早餐品种丰富而且口味不错。,入住当天一进卫生间就有一股不可名状的浓郁气味，打了四个电话给前台才来了一位工作人员。拿着瓶空气清新剂喷了一会味道还是在，工作人员把原因归咎为可能是前一个住客几天没洗澡。帮我们换了房间，晚上洗澡的时候发现浴室下水很慢，基本上是要洗5分钟停5分钟的节奏。还好第二天反馈了之后解决了。酒店设施陈旧，卫生间总有种脏脏的感觉。退房的时候我询问是否换的房和之前我预定的是一样的房型，因为之前入住的是面对街景而且卫生间是有窗的，很明亮。工作人员说是一样的。这样的房间要1200一晚我觉得性价比实在是太低了，完全够不上五星标准！,5,NEG
Chinese,Beijing,北京通州北投希尔顿酒店,停车收费太贵了！,没有,10,POS
Chinese,Beijing,北京通州北投希尔顿酒店,早餐尚可,房间小、服务响应慢，要一个加湿器打电话催了三次！,4,NEG
Chinese,Beijing,北京通州北投希尔顿酒店,,酒店十点过洗澡水不热，打电话问前台。前台说现在是用水高峰期，让我们等会再用。一千多的酒店，这是旅馆么？,5,NEG
Chinese,Beijing,北京通州北投希尔顿酒店,,房间太干燥！！！太热了！中央空调竟然只能制热！无法制冷！还没有窗户！无法通风！！！,1,NEG
Chinese,Beijing,金茂北京威斯汀大饭店,很满意,设施有点旧，价格偏高,9,POS
Chinese,Beijing,金茂北京威斯汀大饭店,,到了后说预定没有成功,3,NEG
Chinese,Beijing,金茂北京威斯汀大饭店,地理位置很好,服务员态度，没有免费停车场，停了一天半停车费370？,3,NEG
Chinese,Beijing,金茂北京威斯汀大饭店,❌差差 是我住过服务最差的一个所谓五星的酒店 太多的失望和无奈,,1,NEG
Chinese,Beijing,北京新世纪日航饭店,房间面积大，床和枕头挺舒服的，退房时间晚,浴房漏水，脚巾全湿了不说，水还会继续流；冰箱启动声音巨大，快赶上发动机了；前台服务人员态度不太好,3,NEG
Chinese,Beijing,北京新世纪日航饭店,,为了考试找了附近的星级酒店打算安心住一晚，结果没想到新日航已经旧成这个样子。冰箱启动声音巨大且频繁，加上临街，到三点都没睡着，吹风机接触不良，电视全是雪花，室内清洁感还不如楼道。前台入住退房也没有隐私感。,5,NEG
Chinese,Beijing,北京新世纪日航饭店,,整個房間感覺很不舒服燈光和色彩都很沉，裝修格調是70~80年代初的日本色彩，顏色太沉，我本人就住得很不舒服,2,NEG
Chinese,Beijing,北平国际青年旅舍,房间采光很好，内里空间宽敞超出想象，从进门之后一楼的休闲区到露台都很宽敞明亮；店里大家都很热心，小姐姐很甜；位置超级好！去哪里都特别方便！！完全满足游客需求！！,房间内wifi有点慢，要下楼才能用,10,POS
Chinese,Beijing,北平国际青年旅舍,位置非常好，就在南锣鼓巷里面。,卫生间异味重,6,NEG
Chinese,Beijing,北平国际青年旅舍,,床铺可能不干净，住后过敏了。,5,NEG
Chinese,Beijing,映向城严选酒店（王府井故宫店）,員工都非常的耐心跟友善，幫我解決了很多問題，第一次來北京真的很不安，還好遇到了這樣一群人，是很窩心的一次體驗,不過可能房間久沒人入住，有點積灰，但總體還算乾淨,10,POS
Chinese,Beijing,映向城严选酒店（王府井故宫店）,员工热情周到,房间的洗澡热水，时冷时热，被罩上有蓝色颜料，有蚊子，洗手池的设计极不合理，漏水，打肥皂不方便，电视机太差劲，没有电视节目可以看，要登陆自己的账号才可以看网络电视，马桶的圈与马桶不匹配，大腿肉会碰在马桶边沿上。没有电梯。,4,NEG
Chinese,Beijing,映向城严选酒店（王府井故宫店）,員工有禮，熱情，負責任￼。,衛生間又￼一股味道，很容易堵塞。晚上遇上鬼砸。,6,NEG
Chinese,Beijing,Stey公寓（北京工体三里屯店）,Stey真的是超级还原了北欧shareapt，不管是设施，管理，还是租客，都是超级赞，会一直支持,,10,POS
Chinese,Beijing,Stey公寓（北京工体三里屯店）,很一般…….,,5,NEG
Chinese,Beijing,Stey公寓（北京工体三里屯店）,智能家电,卫生条件比较差，卫生间和房间打扫太粗糙了，黑色水龙头都是白色水垢，而且屋里设施太差,1,NEG
Chinese,Beijing,兰花宾馆,服务非常好，酒店布置的也非常雅致，房间干净整洁，在胡同里也非常安静。我们全家都非常喜欢！第一天来的时候提供给我们洗漱，还赠送了冰咖啡，疲惫一扫而光。一楼的福荣记味道也很赞。,最后一天由于时间问题我们选择了地中海式早餐，怎么说呢，味道真的一言难尽，希望西式早餐能有所改进，我们在欧洲住了这么多年，真的感觉这个早餐有太多需要改进的地方了。,10,POS
Chinese,Beijing,兰花宾馆,服務人員熱心搬行李,"沒提供礦泉水
隔音差",6,NEG
Chinese,Beijing,兰花宾馆,"早餐非常棒，超級讚！ 好吃份量足！
服務員不打擾住客，特別好。","房間太暗了，因為房型的緣故，自然光不足可以理解，那麼房內燈光就應增加讓住客可以選擇更明亮的光線。
太多小飛蟲
房內和浴室的置物枱面太少。很多東西無處放
插座太少，而且全被房內的電器佔用了。插座位置也不好，沒考慮現在需要充電的設備有很多。
空調和浴室通風設備噪音略大。
電視只能看优酷，海量的外國影視內容不知道怎麼打開。也沒有說明。",6,NEG
Chinese,Beijing,北京凯丽家酒店,早餐很讚 尤其是咖啡 交通方便 地鐵就在附近 很喜歡這裡,都很喜歡,10,POS
Chinese,Beijing,北京凯丽家酒店,地理位置很好，去各个景点都很方便,"1、可能是四合院改造的缘故，房间小，床也小，入住体验感不太好；
2、早餐每天8点才会提供，来北京旅游一般都挺早出门，无法评价；
3、基本不提供任何酒店服务；
4、服务标准不统一，既然不让小朋友在天井里玩耍就应一视同仁",4,NEG
Chinese,Beijing,北京凯丽家酒店,早餐还不错。清扫的阿姨人也很好。,安排房间的工作人员实在是缺乏对房间的管理能力。定的双人床到达后被告知双人床被别的住户使用了，并一直试图劝说我住另一间大床房，给我的理由是“住我房间的住户懒得换”。我明确表示了不愿意将就大床房和员工房，工作人员撬了门锁把住户的东西搬去大床房，清理后安排我入住。结果第二天才从侧面得知，之前的住户也是定了大床但是到店后发现大床房没有，才勉强同意用双床拼成的大床，将就了一夜第二天又被强行撬锁搬离私人物品，换谁都会心里不舒服的吧…而并不是店家嘴里所谓的“懒得不愿意搬”，气的之前的住户连夜退房。本来就觉得店家管理有漏洞，现在更觉得行事方法也差强人意。为什么客户定的房间会一而再再而三的无法入住？既然没有空房又怎么能在线上显示有房？无论是事出突然的合理解释还是出了问题细心善后，哪一方面店家都没有做好。再加上房间阴暗潮湿，设施简陋，角落都有蜘蛛网和灰尘，床品有没有清理干净的血迹，下雨时大厅里滴滴答答全是漏水需要用盆和桶去接等等…都让我对凯丽家感到些许失望，虽然交通便利，负责打扫的阿姨热心麻利，但是因为入住的种种不愉快，我个人是不不会推荐朋友入住的…,4,NEG
Chinese,Beijing,北京丽亭华苑酒店,工作人员服务态度非常棒！服务主动，负责任。,,10,POS
Chinese,Beijing,北京丽亭华苑酒店,地理位置,由于装修，洗漱的水是棕黑色的，酒店没有任何人主动解释,3,NEG
Chinese,Beijing,北京丽亭华苑酒店,,水是浑浊的，有气味，空调噪声也大,4,NEG
Chinese,Beijing,北京瑜舍酒店,酒店的服務人員無可挑剔，我們在入住當天從機場客戶關係總監,,10,POS
Chinese,Beijing,北京瑜舍酒店,地理位置满意,装修味道和软饮吃的较少 牙刷等物品也需要要 棉签没有 早餐不包含 管理混乱，餐厅说包括餐又说不包函。,3,NEG
Chinese,Beijing,北京瑜舍酒店,位置好,油漆味,5,NEG
Chinese,Beijing,北京饭店诺金-王府井,地點好，舒适，員工態度非常好。,,10,POS
Chinese,Beijing,北京饭店诺金-王府井,地段还可以,基本没有服务可言，牙刷，沐浴露，拖鞋不要不给，天天要打电话问前台索要各种物品。毛巾旧。床非常不舒服，垫子跟床垫尺寸不匹配，恶心的要死，装修非常陈旧，卫生间狭小，居然还没有手持淋浴头，早餐也是很少的品种。下次绝不会再住，价格跟品质极度不匹配。,4,NEG
Chinese,Beijing,北京饭店诺金-王府井,地理位置,前台服务员态度、工作素质,5,NEG
Chinese,Beijing,璞瑄酒店,房間夠大整體清潔，設計好有心思👍服務員態度非常好和細心，早餐美味超贊😋房間內的食品飲品費用全免，還有下午茶享用😄房價絕對超值😎,沒有,10,POS
Chinese,Beijing,璞瑄酒店,整体非常有设计感，走廊的光影效果可以体现酒店的小心思。中餐厅富春居绝对是可以让你在酒店停留一晚的理由,酒店前台的工作人员专业度有待提升，连续刷了我和家人两个预授权，最后在我离店后又通知我需要返回重新操作。头一天晚上请富春居工作人员留在前台的发票，在退房时前台也未提醒我们取，还是返回酒店才取的,3,NEG
Chinese,Beijing,璞瑄酒店,早餐口味不错，仅口味，服务与环境都不好。,"1、房间看似有设计感，但实际非常局促，双人床大概最多1.7米宽，十分不舒服；洗漱位置置物空间很小；2、房间温度一直都在39度！！！无法开凉风，而且空调关上之后会在离开房间后自动开启！联系客服无果最后我们不得不一直开着房间门散热；3、早餐口味虽好，但服务人员无法合理领位，出现原本应我们坐的座位被其他人占据的情况；4、roomservice送达时间慢，答应半小时但超过一小时还未送到，且收费极不合理。点了四个dish（其中包括一碗清汤面），收费990。5、房间根本没有view！想看景山吗？只能在lobby的一扇窗户前看到，想看故宫吗？没有的！
整个住店经历真的太夸张了，这里可能只适合网红来拍照发网上吧。想度假想享受是没有的。",3,NEG
Chinese,Beijing,映向城市文化酒店（北京天安门故宫店）,地理位置不错，在史家胡同里面，喜欢这里的生活气息,,10,POS
Chinese,Beijing,映向城市文化酒店（北京天安门故宫店）,,牆面滲水，污染了我的行李,5,NEG
Chinese,Beijing,映向城市文化酒店（北京天安门故宫店）,工作人员服务很好,房间较小,6,NEG
Chinese,Beijing,北京三里屯通盈中心洲际酒店,"非常好的住宿體驗, 房間大且很整潔",,10,POS
Chinese,Beijing,北京三里屯通盈中心洲际酒店,地點,￼吹頭風筒，￼壞咗，唔想￼更換,6,NEG
Chinese,Beijing,北京三里屯通盈中心洲际酒店,,酒店工作人员没有诚信对客户态度也极差,1,NEG
Chinese,Beijing,北京宝格丽酒店,"房间很大很舒适 设施豪华
员工热情
泳池体验很棒",浴缸边上能加装个防滑扶手就更好了,10,POS
Chinese,Beijing,北京宝格丽酒店,装修风格不错,被子有烟味 然后给我的房间是最里面的一间 没有阳光 洗浴用品也一般,4,NEG
Chinese,Beijing,北京宝格丽酒店,游泳池,服务和硬件跟不上,6,NEG
Chinese,Beijing,北京山士知还四合院精品酒店,第二次过来住，旅游季临时落脚能有睡觉的地方万幸了，大感谢。（不过也请注意是提前一周以上预定的）,第二次booking收到住宿方发来的massage提示定位了，如果是初次入住，胡同里的四合院可能不好找，建议可以在网站这边也可以多加注明。,9,POS
