Language,City Name,Hotel Name,Upside_Review,Downside_Review,Review_Score,Sentiment
Chinese,Berlin,阿玛诺市中心大酒店,地理位置不错，主火走出来过个马路就到了，酒店出来走两步就有个U Bahn的入口，不一定要过马路进主火，内部是新装修的，电梯需要刷房卡才能上楼，相对安全，为了环保，开窗的时候无法同时开空调,枕头太薄，对折起来都不够用，就是塞了一点薄棉花，毫无填充，床垫是海绵床垫，偏软，睡得腰疼，最好是入住前就提供不同的选项给用户选择，冲凉房花洒的固定旋钮松动，无法固定角度，厕所下水道有股轻微的异味，浴室水龙头水压很高，经常难以控制水温和水的大小，马桶水池的水回复速度非常慢，房门非常难关闭，经常听见附近的住户走的时候很大力的关门声,6,NEG
Chinese,Berlin,柏林墙东侧画廊舒尔茨酒店,设施卫生都是一流。位置很好就在柏林东边画廊。离客运站也很近。,价格略高。临时续订一晚，体验到了从未有过的高价。,9,POS
Chinese,Berlin,柏林墙东侧画廊舒尔茨酒店,对面是火车站,酒店不能付现金，房间实在是太小了，直接坐床上，位置太偏僻,3,NEG
Chinese,Berlin,柏林墙东侧画廊舒尔茨酒店,位置，早餐,房间服务,6,NEG
Chinese,Berlin,柏林波茨坦广场斯堪迪克酒店,交通非常方便早餐很豐富選擇的樣式很多,,9,POS
Chinese,Berlin,柏林波茨坦广场斯堪迪克酒店,,冰箱不制冷，空调也找不到开关。跟前台反应问题，前台说马上会找人去修，但是没有反馈,4,NEG
Chinese,Berlin,柏林波茨坦广场斯堪迪克酒店,環境很好,密碼給錯，打電話去詢問，一直被威脅要掛我們電話，只因我們講的訂房名字不對，我先生用我的名字訂，但不確定是中文還是英文。都報給他了，結果是掛夫姓的名字。anyway我們有訂單編號，他不要，脾氣壞到一直要掛電話，沒見過服務那麼差的接線生。,6,NEG
Chinese,Berlin,玛丽蒂姆柏林普洛艾特酒店,自助早餐很丰盛，酒店有游泳池和健身房，房间设备齐全，停车位很多,房间网络不稳定，信号较弱，需要走到靠近电梯的地方才能登录网络。,9,POS
Chinese,Berlin,玛丽蒂姆柏林普洛艾特酒店,地理位置优越,洗手间的卫生需要打扫干净,5,NEG
Chinese,Berlin,玛丽蒂姆柏林普洛艾特酒店,空間大,使用熱水壺煮水泡茶時，插電卻跳電，結果處理反應有點慢，也沒有重新補一瓶礦泉水給我，讓我整晚非常渴,6,NEG
Chinese,Berlin,柏灵城中心假日酒店,"歐陸早餐豐盛可口，自動化鬆餅機很有趣，但吸引了太多人排隊。
地點離各種大眾交通工具不遠，方便轉乘。
馬路對面有超級市場，對自由行的旅客很方便。
退房時間是中午十二點，早上出去走走還可以回來休息一下。",,9,POS
Chinese,Berlin,柏灵城中心假日酒店,一般，供应偏慢,,6,NEG
Chinese,Berlin,柏灵城中心假日酒店,"入住期间，电脑在房间内丢失。
前台和酒店没有解决方案，只能自己报警。
holiday inn作为一家知名高端酒店，不能保证消费者的财产安全，且无法通过自查来解决问题，很让人失望，不得不以不报警处理。","入住期间，电脑在房间内丢失。
前台和酒店没有解决方案，只能自己报警。
holiday inn作为一家知名高端酒店，不能保证消费者的财产安全，且无法通过自查来解决问题，很让人失望，不得不以不报警处理。",1,NEG
Chinese,Berlin,"Hotel Berlin, Berlin, a member of Radisson Individuals","有空调！好久没吹空调盖被子了。
地理位置非常好，远离市中心，足够安全。
距离铁铁站很近。去哪里都不会太麻烦。
员工非常友好
健身房和桑拿🧖都很好",晚上桑拿房里经常没有干净的浴袍浴袍,10,POS
Chinese,Berlin,"Hotel Berlin, Berlin, a member of Radisson Individuals",有桑拿健身,房間沒空調，房間清潔人員時間不穩定，有時上午有時下午。毛巾忘了換。,6,NEG
Chinese,Berlin,"Hotel Berlin, Berlin, a member of Radisson Individuals",装修还不错,网络很差，基本连不上；淋浴头是坏的，旁边有一栋在装修的房子，噪音非常大，早上根本睡不着。,2,NEG
Chinese,Berlin,柏林米特莱昂纳多酒店,非常好的地點，離博物館島很近。晚上還能去腓特烈宮看表演，價格也十分合理。,,10,POS
Chinese,Berlin,柏林米特莱昂纳多酒店,地點還是不錯，交通非常方便。,隔音設備有點差一直都有聽到隔壁房間人的咳嗽和打噴嚏，我最不想得到走廊盡頭最後一個房間，這次得到了。,5,NEG
Chinese,Berlin,柏林米特莱昂纳多酒店,交通方便,清洁工作,6,NEG
Chinese,Berlin,Park Plaza Berlin,非常好的酒店！地理位置也很好，在超市附近！酒店早餐超级好吃！楼下也有打印机可以用！,没有啥不满意的,10,POS
Chinese,Berlin,Park Plaza Berlin,早餐很好。地理位置也不错，到地铁站很方便。,房间价格比较贵,5,NEG
Chinese,Berlin,Park Plaza Berlin,,卫生间没有排风,5,NEG
Chinese,Berlin,The Westin Grand Berlin,地理位置好,员工整体可以再友好一点，尤其是对小baby。当然有个别员工还是很友好的。你们应该对带孩子的家庭有更多的理解。我们在住宿期间和早餐期间随时随地都有被催促的感觉。我们10点离开房间的时候，服务员就站在我们门头等着进来打扫卫生….,6,NEG
Chinese,Berlin,The Westin Grand Berlin,床很舒服，地理位置优越,还是不够热情,8,POS
Chinese,Berlin,The Westin Grand Berlin,地理位置,"服务等待时间
客房没有清理",1,NEG
Chinese,Berlin,柏灵莱昂纳多酒店,,房间太冷了，没有暖气，空调也不热,4,NEG
Chinese,Berlin,柏灵莱昂纳多酒店,地理位置优越，停车也方便。还有早餐选择很多非常不错。,"床真的声音很大, 枕头里面是一团团的，有待改进。",7,POS
Chinese,Berlin,柏灵莱昂纳多酒店,地理位置,名不符实，最多三星级标准，早餐照片与实际相差太大，没有泳池，没有健身房，价格与服务和设施完全不符!,1,NEG
Chinese,Berlin,柏林海波龙酒店,客房設計非常舒適又乾淨,,10,POS
Chinese,Berlin,柏林海波龙酒店,地理位置,前台服务人员素质极差，说话语速超快 而且口齿不清 没有耐心 隔音效果太差 感觉睡在马路上．而且每天早上8点半左右被清洁人员敲门吵醒 昨晚回房竞然发现一个陌生的黄色的饮料盒躺在我们的垃圾桶 很吓人的不会再去第二次了,1,NEG
Chinese,Berlin,Steigenberger Hotel Am Kanzleramt,火車總站近在咫尺，位置非常好，房間蠻大，落地大玻璃開陽景觀，有咖啡機、煲水機，早餐非常豐富,就是欠了浴缸,9,POS
Chinese,Berlin,Steigenberger Hotel Am Kanzleramt,地理位置很好，就在DB旁边，出行方便,我房间的空调坏了，第一晚到的晚以为是中央空调，第二天问了前台才知道空调温度是可控的，我房间的空调坏了无法控制，为此我打了至少4次前台的电话要求来人修理。前台第一次给我说要插卡（没插卡我怎么出现在房间里打电话？），第二次说派个人结果没来，第三次来了个不会说英文也不会开空调的，第四次才来了个空调维修师傅，显然这个问题不是第一次发生，他花了大概十分钟通过衣柜上的什么装置才修好空调。临走的时候和前台说了这件事情前台毫无歉意。,4,NEG
Chinese,Berlin,阿勒托库单酒店,離車站與超市近，冷氣度過熱浪，電視連接電腦方便,,10,POS
Chinese,Berlin,阿勒托库单酒店,设施齐全，房间很温暖，干净,网络速度非常非常非常慢，保洁人员未敲门就进入房间，当时我们还在睡觉受到了惊吓，也没有道歉,5,NEG
Chinese,Berlin,ARCOTEL John F Berlin,酒店很干净，很舒服，房间布置也很好，楼下吧台不错，态度很好。,前台接待的态度一般,10,POS
Chinese,Berlin,ARCOTEL John F Berlin,,预定订单金额是1077.97欧元，实际信用卡扣款5笔，共计1311.27欧元，我想知道这1311.27欧元的明细，入住4个房间的明细，多次联系客服，但无法得到有效回复，客服没有跟进，酒店没有回复，什么都没有,1,NEG
Chinese,Berlin,Hotel ROMY by AMANO,乾淨 床很舒服 廁所浴室整潔乾淨舒適,網路訊號不穩 房間Wi-Fi連不上,9,POS
Chinese,Berlin,Hotel ROMY by AMANO,位置滿分,訂了有陽台的房間，也付了較高的價格，但陽台門的設計錯誤，門開不了，向前台反應後，前台說因為我們太晚check in所以沒有其他房可以換，雖然送了免費早餐，但整體的處理態度讓人很不開心，感覺糟透了,4,NEG
Chinese,Berlin,库尔菲尔斯滕斯堪柏林酒店,地点非常好 去动物园和卡迪威都在步行距离内 早餐很丰富 12岁以下孩子免费。酒店周围都是餐厅 而且都非常好吃。家庭房也很适合我们2个大人＋2个12岁孩子，上下铺的孩子床比沙发床舒服多了。总之 这是一家适合家庭游的酒店。,,10,POS
Chinese,Berlin,库尔菲尔斯滕斯堪柏林酒店,地理位置不错,茶杯还有茶渍或者是咖啡渍，这点最不满意，房间小、设施陈旧，不推荐,4,NEG
Chinese,Berlin,柏林亚历山大广场莱昂纳多皇家酒店,开放式浴室很不错的设计！暖气很充足舒服！电视很大能连YouTube ，居然来送了一瓶水很贴心。隔音也很好,"一次性浴帽用完丢掉以后第二天没有给新的
漱口水忘记倒了，打扫房间的清洁人员居然没有倒掉……",10,POS
Chinese,Berlin,柏林亚历山大广场莱昂纳多皇家酒店,"Sauber, alles Standard","Ich bin echt Tag nach Tag während Aufenthalt wütend. ich bin nicht so sensitiv zu Geräusch, aber die Geräusche sind unfassbar!!!!!!!!!!!
1. jeden Tag um 8 Uhr lautet die Kirche.
2.die Zimmertür ist unfassbar laut. Um 2 Uhr in der Nacht und um 6 Uhr morgen zitterten die ganze GK-Trennwand im Zimmer, weil die Nachbarn die Tür geschlossen haben. 
3. direkt neben der Straße, die Straße ist auch an 7 Uhr schon sehr sehr laut. uns wurden auch nicht angeboten, ein Zimmer zu Innenhof zu wählen. 
Der Aufenthalt hier in diesem Hotel ist unfassbar schlecht, mindestens für Standard Zimmer.
Ich würde alle Pärchen, die das Standardzimmer buchen wollen, das Hotel abraten!!!!!
Ich bezweifle wegen des Aufenthalts, ob das Hotel in Booking und Google Bewertungen kaufen!
Noch nie habe ich eine schlechte Bewertung geschrieben. Das ist das erste Mal in Leonard auch das letzte mal!
这个酒店的标准房间非常非常吵，早上很早教堂就开始敲钟，而且房间的门没有缓冲，白天和夜里只要邻居开关门就会砰砰砰的响，临街的房间也超级无敌吵，早上很早就开始装卸货。
不要相信他们的好评，我怀疑他们酒店买了评价！我平时一点噪音都睡得不错，这个酒店真的让我长了黑眼圈😭😭😭😭",1,NEG
Chinese,Berlin,柏林欧洲之星酒店,看到評論說酒店的位置很好，沒想到那麼好，出了火車站，走不到一分鐘就到了。門口就是餐廳，超商，去任何景點都非常近，基本可步行。交通上，基本上頭上就是火車站，腳下就是地鐵站，手邊就是電動滑板車，總有一款交通工具可以讓你滿意。酒店前台如果有需要交流的時候，都很熱情禮貌。酒店人員平時路過見面雖然是德式冷漠臉，但也不會讓人不舒服。房間簡直是巨大，第一次感覺，住酒店就跟住在一個家裡，可以把行李箱，衣物全部整理收拾起來，然後過道還可以用推拉門隔離起來，變成一個獨立房間。酒店，房間外的設施乾淨整潔，沒有過多的裝飾，但是不會感覺單調。,酒店的掛牌非常不人性化，只有“不要整理牌”和“準備好了”。因為早上起來晚，所以都會掛“免擾牌”結果酒店只有“不要整理牌”沒辦法，只能掛這個，結果晚上回來，發現就真的直接不打掃了。後來掛了“準備好了”，也沒人來打掃，經歷兩個晚上後，眼見廁所到了斷貨的邊緣，才在第三天直接去前台人工登記，麻煩他們來打掃並加上廁紙。另外浴室噴頭出水很大，結果只做一半遮擋，所以一不小心，就會把水直接撒到到處都是，實在是不方便。,9,POS
Chinese,Berlin,柏林欧洲之星酒店,位置非常好，,网络和早餐，太让人失望了。但是wifi基本是零，经常断线，我很生气，太耽误事了。早餐每天都是一样的，种类选择不多，只够3星的水平，房间很干净，但是浴室的角落都是发霉的，五星级酒店出现这样的低级错误，不应该。,3,NEG
Chinese,Berlin,INNSiDE by Meliá Berlin Mitte,"設計感的大廳
客房大
浴室乾濕分離
床鋪舒適",房間空氣不流通,9,POS
Chinese,Berlin,INNSiDE by Meliá Berlin Mitte,地理位置不错， 附近生活超市也蛮多的,卫生需要改进， 第一天入住房间时房间角落都是灰，床上的被单还前客人的头发，给前台打电话，送来了新被单都是没有帮忙更换，是自己换的。☹️第二天通知前台，要求前台仔细检查床单，但是还是没有，将旧的还是套在床上！,5,NEG
Chinese,Berlin,柏林上西区一号汽车旅馆,交通地點非常方便,房間很小，廁所很小，乾濕分離做得不好，洗完澡，洗手檯前跟馬桶都會濕掉。,6,NEG
Chinese,Berlin,柏林上西区一号汽车旅馆,酒吧 地理位置真的非常不错,拖鞋也没有,7,POS
Chinese,Berlin,SANA柏林酒店,乾淨、位置方便、安全,無,9,POS
Chinese,Berlin,SANA柏林酒店,外观设施挺好,空调，住的时候开空调会有下水道的味道，换了一次房间，还有一样的情况，很失望,4,NEG
Chinese,Berlin,加泰罗尼亚柏林米特酒店,整体很舒适，提前一些到也让我们入住了。还为我们升级了房间，很不错的体验。,,10,POS
Chinese,Berlin,加泰罗尼亚柏林米特酒店,工作人员服务还是不错的，解决问题也比较快,地理位置一般，周边感觉比较陈旧，设施也比较陈旧，空调声音很想，水槽下水也有些问题。,5,NEG
Chinese,Berlin,38酒店（原施彻恩维特酒店）,设施，早餐都非常不错,,9,POS
Chinese,Berlin,38酒店（原施彻恩维特酒店）,早歺很好,,6,NEG
Chinese,Berlin,Classik Hotel Alexander Plaza,前台很热情友善，效率高，酒店位置好,火警令人迷惑，早上全楼一起响吓人一跳,9,POS
Chinese,Berlin,Classik Hotel Alexander Plaza,地理位置不错，交通、饭店和超市都在附近，去博物馆也很近。早餐很有特色的，但偏贵，所以吃早饭人不是很多。前台、餐厅和打扫卫生的工作人员都很好，有问题及时会帮助你。,房间的窗是打不开的，却漏风（消防安全应该不通过）。房间并没有写字桌，而上面写着是有的。房价并不便宜，但硬件问题很令人失望的,6,NEG
Chinese,Berlin,Clipper Boardinghouse - Berlin-Gendarmenmarkt,干净舒适。地址位置很好，距离柏林的主要景点都很近。,,10,POS
Chinese,Berlin,Clipper Boardinghouse - Berlin-Gendarmenmarkt,地点方便旅游,房间内没有空调，每晚都被热醒,5,NEG
Chinese,Berlin,Hampton By Hilton Berlin City East Side Gallery,早餐不错，地理位置很好，前台工作人员很友好,"除此之外找不出任何优点！床上有头发，20平方米的房间没有桌椅，只能坐在床上，整个房间十分拥挤！入住过很多20平方米以内的酒店房间，基本上都会配备一张椅子，这家酒店没有椅子而且房间格局相当狭小。
因为走得急同伴没带拖鞋，就去问前台是否出售拖鞋，结果也没有……也不出售柏林的公交票。什么都要游客步行去商业街购买………
这家酒店除了距离柏林墙近，房价包早餐之外找不到优点，同等价位之下能找到更好的！",5,NEG
Chinese,Berlin,Hampton By Hilton Berlin City East Side Gallery,员工很nice,,7,POS
Chinese,Berlin,柏林洲际酒店,房间很干净，床垫很舒服，咖啡机很棒,枕头太软了，洗发水质量不够好，没有提供牙刷,9,POS
Chinese,Berlin,柏林洲际酒店,,该酒店擅自使用房客的信用卡二次无理由的划款：第一次划转298欧元，这个数值与房价都无关系。我们通过翻译找到前台回复是电脑自动生成的，经过我们严正交涉半小时退回信用卡中；第二次是放着房款、押金的冻结款不解除，单独又支付一笔房款，整个财务操作都不符合国际惯例和德国、柏林大多数酒店的操作。到今天冻结款依然不解除！实在让人恶心！,3,NEG
Chinese,Berlin,柏林波茨坦广场皇冠假日酒店,房間很大，有空調，乾淨,金額頗高，沒有相對性的高服務,5,NEG
Chinese,Berlin,HighPark by Palmira,非常棒的住宿，地点、接待服务、设施、清洁都很满意，下次还会住，也会推荐,,10,POS
Chinese,Berlin,aletto Hotel Potsdamer Platz,性价比特别高，房间设施齐全方便、现代、干净；地理位置就在地铁站旁边，去哪里都很方便，下次来柏林还会选择这里。,洗手间浴室的干湿分离需要提高。,10,POS
Chinese,Berlin,米特区查理检查哨NH精选酒店,位置很棒，也很舒适,,9,POS
Chinese,Berlin,Grimm's Potsdamer Platz,离地铁站近，员工友好，房间干净,无,10,POS
Chinese,Berlin,Precise Tale Berlin Potsdamer Platz,"房間裝潢擺設非常特別不像一般的飯店
尤其是廁所的裝飾風格
洗澡都會覺得愉悅
入住後送上的餅乾和手寫卡片很貼心
餐廳的環境舒適
工作人員都很輕切",房間的隔音沒有很好,10,POS
Chinese,Berlin,希尔顿柏林市西部酒店,住宿含早餐、员工的服务态度质量上乘。,疫情结束后早餐时间若能再延长一个小时就更好了。,10,POS
Chinese,Berlin,智选假日酒店 - 柏林 - 亚历山大广场,酒店的清洁度和整齐度真是太优秀了！对强迫症患者非常友好！房间的空间大小虽然尚可，但是配有可书写或是打字的桌面和椅子，对于在旅行中需要码字的人来说非常重要！早餐种类很丰富，鸡蛋可以加小葱！还有黑莓气泡水！,床的长度有些些短，睡觉的时候得斜着，不过床品十分舒适！隔音也非常优秀！,10,POS
Chinese,Berlin,Hotel AMO by AMANO Friedrichstraße,櫃檯人員親切，整體整潔，浴室大明亮，相關備品應有盡有,客房內燈光太昏暗，放置行李空間略小,9,POS
Chinese,Berlin,"Radisson Collection Hotel, Berlin",很新的现代酒店，设备齐全，5天房间外面对着一个巨型水族缸也不会烦,我们选择了不用每天房间打扫服务，如果2，3天还行，5天真的不行，厕纸用完了，浴巾太湿了，都要问服务员要，一个会说德语的上岁数的女服务员，问她要厕纸态度很差，竟然让我先生换垃圾桶，下次一定要选择每天房间打扫服务。,10,POS
Chinese,Berlin,Vienna House by Wyndham Andel's Berlin,地理位置方便优越，临近地铁，酒店环境赏心悦目,,9,POS
Chinese,Berlin,about:berlin Hotel,飯店位於市中心，購物與用餐都非常方便！,沒有冰箱,9,POS
Chinese,Berlin,the niu Hide,酒店装修陈设比较新，现代风格。各种家具都很舒适。浴室干净，洗浴用品齐全，有干净的毛巾和浴巾。虽然房间离铁轨不远，但窗户隔音很好，关上窗户之后没有明显噪音。楼下是一家商场，可以很方便的解决早饭。性价比很高的一家酒店！,距离市中心较远。,9,POS
Chinese,Berlin,Quentin XL Potsdamer Platz,位置还挺不错的，房间也很卫生干净！,,9,POS
Chinese,Berlin,柏林城西假日酒店,舒服的床，涼爽的冷氣，明亮的浴室,沒有提供冰箱,9,POS
Chinese,Berlin,柏林市中心亚历山大广场希尔顿汉普顿酒店,早饭还不错，餐厅很大，人也比较多，非常热闹。,,9,POS
Chinese,Berlin,柏林库丹姆H10酒店,位置很好坐车购物都很方便，接待员很和蔼，环境也很好，很开心，下次来还住这里,,8,POS
Chinese,Berlin,AMANO East Side,房間非常乾淨！床鋪很舒服，地點也很方便！,,10,POS
Chinese,Berlin,"Crowne Plaza Berlin City Centre Ku'damm, an IHG Hotel",很完美,无,10,POS
Chinese,Berlin,KPM Hotel & Residences,房间整洁干净舒适，设施齐全还很大,无,10,POS
Chinese,Berlin,the niu Dwarf,酒店是新装修的，很干净舒适。离S Bahn车站只有200米，交通方便！并且性价比很高，非常推荐~,入住办理需要等比较久。,10,POS
Chinese,Berlin,斯图加特瑞拉科萨酒店,位置非常好，在东西柏林之间，交通也很便利，距离查理检查站非常近，离勃兰登堡门和国会大厦也很近，周边有好几个博物馆。,,9,POS
Chinese,Berlin,柏林美利亚酒店,前台的工作人员非常友善，我的房卡落在房间里没拿，她态度很好的给了我新的房卡。,,10,POS
Chinese,Berlin,柏林辉盛凯贝丽酒店式服务公寓,员工非常友好 会主动用英语微通行不说德语的朋友介绍酒店 洗护用品很棒 位置在博物馆岛上很便利,空调奇奇怪怪不太好调 声音比较大 临街的房间有车经过会比较吵,8,POS
Chinese,Berlin,柏灵Q!酒店,住宿地點很好，附近餐廳很好，員工服務很好。離地鐵U1線(慢慢走路8分鐘)跟快鐵(慢慢走路10分鐘)都很近。,無,10,POS
Chinese,Berlin,柏灵纽沃酒店,室内粉色系很清新浪漫，环境不错，附近中国籍东南亚小饭馆很多，离东边画廊不远，去往主要景点的交通很方便。,,10,POS
Chinese,Berlin,AC Hotel by Marriott Berlin Humboldthain Park,设施很新，员工很礼貌。,位置不是很好，土区跨年夜都是随处扔二踢脚的和烟花的不是很安全。大床房是两个床拼一起的导致中间经常被挤出一个大缝隙。浴室排风扇没有有效运行。,8,POS
Chinese,Berlin,Dorint Kurfürstendamm Berlin,服务员很热心，房间整洁卫生，酒店早餐不错～,暂无,10,POS
Chinese,Berlin,Essential by Dorint Berlin-Adlershof,位置安静，附近停车免费，人员热情,入住有点晚，没有按要求加床,8,POS
Chinese,Berlin,Grimm's Berlin Mitte,員工很熱情解答問題、以及房間有pad可以用,沒有,9,POS
Chinese,Berlin,Hotel BIRGIT Berlin Mitte,"Breakfast was good. There wasn't a lot of variety, but the ingredients were fresh. The sound insulation of the room was good, and I slept well. The location is also good, the nearest U Bahn station is about 5 minute walk away. The hotel concierge at the front desk is very friendly.
早餐不错，虽然种类不算很多，但是食材都挺新鲜的。房间隔音效果不错，睡得很好。地理位置也不错，最近的一个U Bahn站步行5分钟可以到。前台的服务人员挺友善的。","I am not 100% satisfied with the breakfast. The juice replenishment speed is very slow. After 8:30, the juice was out and there was no update after waiting for a long time. The ice next to the juice can't help itself, but there's no note or other warning. When my husband went to pick it up, he was stopped by the staff in an unfriendly way (actually I think it was stopped by animadvertion), which I found a little uncomfortable. We didn't know the ice was untouchable. 
早餐有一点不满意，果汁补充速度很慢，8点半以后果汁就被倒光了，等了很久也没有更新。果汁旁边的冰不能自取，但没有字条或者其他提示信息。我老公去取的时候被员工不太友好的制止了（其实我觉得算是喝止），我觉得这一点有点让人不舒服。我们并不知道那些冰是不能拿的。",9,POS
Chinese,Berlin,"Hotel Indigo Berlin – Ku’damm, an IHG Hotel",地理位置佳,床太軟,8,POS
Chinese,Berlin,"Lindner Hotel Berlin Ku'damm, part of JdV by Hyatt",非常好的位置，服务好，早餐丰富，周围性价比最高之一,无,10,POS
Chinese,Berlin,NH酒店柏灵亚历山大广场店,設備、整潔度,櫃檯態度較為冷淡,8,POS
Chinese,Berlin,Nena Apartments - Kreuzberg 61,設備齊全且現代化。有廚房，可以進行簡單的料理。,"1.地板乾淨度不佳，有灰塵，床底下還有一張不是我們製造的衛生紙（？）
2.床板會發出聲音，對淺眠的人來說是辛苦的。
3.枕頭太軟了（不過這個很主觀）。",7,POS
Chinese,Berlin,Nena Apartments Hermannplatz,CP值很高,可能需要多一點裝潢,10,POS
Chinese,Berlin,Schlosshotel Berlin by Patrick Hellmann,spa,家具设计摆放,10,POS
Chinese,Berlin,TITANIC Comfort Kurfürstendamm,乾淨舒服,電梯慢，沒還肥皂/沐浴乳,10,POS
Chinese,Berlin,Urbn Dreams II,廚房設備完善,浴室沒有乾濕分離,9,POS
Chinese,Berlin,Vienna House Easy by Wyndham Berlin Prenzlauer Berg,距跳水比赛的球馆很近，而且交通也很方便，旁边就是S-Bahn和Tram。,Wifi实在太差了,8,POS
Chinese,Berlin,"Wilde Aparthotels by Staycity, Berlin, Checkpoint Charlie",一切都好，就是有些热，通风不畅，没有空调,没有空调夏天真的太热了,8,POS
Chinese,Berlin,acora Berlin Living the City,房间很干净宽敞，服务看上去也升级了,"酒店依然没有前台，房间里也没有可以联系工作人员的座机，只能通过邮件联系。。。
此外房间的隔音有待改善",8,POS
