Language,City Name,Hotel Name,Upside_Review,Downside_Review,Review_Score,Sentiment
Spanish,Rome,Trevi 41 Hotel,,"Llamé dos veces al telefono antes de llegar comentando que iva a ir con mi madre, y cuando llegué nada estaba planificado, nadie me comentó que no era en el mismo hotel si no en una área al lado del hotel, los colchones de la primera habitación estaban sucios, nos dieron otra hab después de aver reclamado.
Las nuevas camas estaban sin cubre colchón, con un apaño hecho con sábanas. Las dichas sábanas eran pequeñas y se salían de la cama. 
La ducha tardaba mucho en calientarse, el tel de la hab no funcionaba y el aire acondicionado muy sucio.
Por suerte el personal reaccionó, prontamente.
La votación coerente sería...
Plataforma Booking 2 por no decir y no corroborar el estado de las estructura que promociona.
Estructura hotel 3 porque se tendría que invertir más para que el cliente no tenga repeluz cuando vuelve para descansar
Personal 12 sobre 10 para suplir las lacunas elencada antes 
Muchas gracias al equipo del hotel, Booking y propiedad muy mal hecho",5,NEG
Spanish,Rome,Trevi 41 Hotel,lo mejor la ubicación,"la primera noche nos alojaron en el anexo y no está nada bien. ninguno de los edificios tiene ascensor. las sábanas eran pequeñas para la cama. No tienen comedor para el desayuno por lo que si lo quieres, debes tomarlo en la habitación, cosa que no hicimos. El personal amable",6,NEG
Spanish,Rome,Esposizione Palace Hotel,"habitación muy amplia, cómoda y linda .
el hotel tiene excelente ubicación 
es muy limpio",nada,10,POS
Spanish,Rome,Esposizione Palace Hotel,"Lo amable q han sido el personal cuando lo hemos necesitado, q ha sido pocas veces","Que está en bloque de pisos y está en 2 plantas, pero tampoco es una molestia",9,POS
Spanish,Rome,Esposizione Palace Hotel,"La ubicación es excelente, tenes acceso a todos los monumentos y sitios históricos con mucha facilidad. El transporte público te lleva y te trae a la zona del hotel con rapidez.
En cuanto a la habitación, es todo nuevo y de primera calidad. Cama y almohadas comodas. La higiene es permanente. Teníamos un patiecito privado que permite acceso al aire y luz. Tienen cafetera nespresso con cápsulas de cortesía todos los día y jarra eléctrica con tes muy ricos para merendar o desayunar por tu cuenta ahorrando un poco de gastos. El frigobar te permite también tener algo fresco para comer si lo deseas. Agradecida a Javier y a los chicos y chicas de la recepción muy atentos a nuestras necesidades.","El único inconveniente es que como el edificio es antiguo, el ascensor tiene muy poca capacidad, al llegar al hotel, subi yo con las 3 maletas y mi marido tuvo que ir por escaleras. Luego nos fuimos arreglando. Pero es lo único.",9,POS
Spanish,Rome,Esposizione Palace Hotel,"La ubicación del hotel esta cómodo, sobre un avenida importante, cerca del área arqueológica, la plaza Venecia y el Coliseo, la habitación y el baño muy lindos, grandes y limpios, el desayuno era muy sencillo y en la habitación, contaba con frigobar y recipiete para calentar agua.","Por el horario de mi vuelo avisé que llagaría a media noche, no había personal para abrirnos la puerta.",9,POS
Spanish,Rome,Esposizione Palace Hotel,"Me gustó la habitación en general (salvo lo que detallo en el apartado siguiente), era amplia y confortable, el baño estaba muy bien y la limpieza general fenomenal","La contraventana estaba estropeada y a partir de las 06h AM la luz del dia nos desvelaba, se lo comenté al personal y ya sabían que había ese problema aún así no hicieron o no pudieron hacer nada.
Por otra parte me comentaron que desde la pandemia habían quitado el alojamiento con desayuno incluido por el tema de las distancias y contagios………..lo cual no me pareció del todo bien, ya que es un servicio que por el tiempo que ha pasado que podían haber restablecido 
El armario era un poco pequeño y sin baldas, tratándose de una habitación para 4 personas",9,POS
Spanish,Rome,Esposizione Palace Hotel,"La ubicación excelente. Para movernos andando por la ciudad.
Nos atendieron con mucha amabilidad. 
La habitación muy agradable y la cama muy cómoda.","La ducha necesitaba mantenimiento.
El pestillo interior de la habitación no funcionaba.
En la TV no había ningún canal en español.",9,POS
Spanish,Rome,Esposizione Palace Hotel,"Ubicación muy centrico, cama comoda y habitación doble grande.","Habitación ubicada en la primera planta justo delante de la entrada de otro hotel donde por la noche escuchas perfectamente cuando introducen el codigo de entrada. Justo debajo hay una sala de fiestas y no conseguimos dormir hasta las 4 de la mañana. Por ultimo la habitación no tiene ventanas, solo una en el baño. No volveria a repetir.",4,NEG
Spanish,Rome,Esposizione Palace Hotel,"Era sin desayuno, la wifi no existía, el personal fue muy atento pero a partir de las 2pm el hotel quedaba solo , lo mejor fue la ubicación","La cama fue lo más incómodo de todo mi viaje, el wifi no llega a las habitaciones, yo tenia que hacer un trabajo ni hablar de mirar el celular",3,NEG
Spanish,Rome,Esposizione Palace Hotel,La ubicación.,"La habitación era muy pequeña, tardaba muchísimo en salir agua caliente para bañarse,no había cápsula de café.
Se las pedimos y jamás nos la trajeron",5,NEG
Spanish,Rome,Esposizione Palace Hotel,,"Por el mismo dinero se puede encontrar un alojamiento mejor, NO ES SEGURO, me robaron en mi habitación, no volvieria ni tampoco lo recomiendo.",6,NEG
Spanish,Rome,Esposizione Palace Hotel,"El personal fue muy amable y nos dio instrucciones de como llegar a los diferentes lugares de interés. La habitación espaciosa y limpia, cama cómoda.","La ubicación es céntrica pero la avenida de mucho tránsito, por lo que resulta de mucho ruido. El aire de la habitación no funcionaba, no refrescaba y hacía mucho ruido, por lo que tuvimos que abrir la ventana. El clima era agradable por lo cual no insistimos con el tema del aire, sin embargo, el ruido de la calle era molesto. Por la forma que tiene el hotel, (comparte el edificio con otros alojamiento y oficinas) no me sentí segura.",5,NEG
Spanish,Rome,Esposizione Palace Hotel,La ubicación es perfecta.,Si la habitación da a la vía posiblemente el ruido moleste un poco. Nada exagerado… solo un detalle.,6,NEG
Spanish,Rome,Esposizione Palace Hotel,Excelente ubicación y limpieza,"La habitación era muy pequeña, no había lámparas de velador (solo en el techo) que no es lo que se muestra en las “imágenes de referencia” tuvimos problema el aire acondicionado ya que hacia mucho ruido y no nos dieron solución",5,NEG
Spanish,Rome,Chic & Town Luxury Rooms,"Todo limpio, buena ubicación",,10,POS
Spanish,Rome,Chic & Town Luxury Rooms,"Ubicación, servicio, limpieza",No tenía vistas,9,POS
Spanish,Rome,Chic & Town Luxury Rooms,El personal encantador. Sitio muy acogedor y mucha privacidad.,,9,POS
Spanish,Rome,Chic & Town Luxury Rooms,Super cómoda la habitación,,9,POS
Spanish,Rome,Chic & Town Luxury Rooms,"Ubicación inmejorable! La cama y las almohadas comodísimas.
Personal muy amable y atento. Nos han dejado hacer el check-out más tarde, cosa que se agradece!
Repetiré sin duda",No conseguimos conectarnos al wifi. No llegaba apenas señal,9,POS
Spanish,Rome,Chic & Town Luxury Rooms,"Buena ubicación
Muy buena arención del personal",nada,9,POS
Spanish,Rome,Chic & Town Luxury Rooms,La ubicación,"Habitación pequeña, muy cara para lo que ofrece, y lo peor que la ducha está en la habitación y no en el baño, cosa que no se avisa",4,NEG
Spanish,Rome,Chic & Town Luxury Rooms,La ubicación es su fuerte del hotel,"Realmente no regresaría, es un lugar viejo, socio, nos abrieron la puerta en la noche otros viajeros por error, no se nos abasteció de papel higiénico en dos dias, no hay elevador para mover tus maletas con libertad.",4,NEG
Spanish,Rome,Chic & Town Luxury Rooms,Las fotos no es lo q ofrecen,Recepción habitación,4,NEG
Spanish,Rome,Chic & Town Luxury Rooms,la ubicación,la habitación,4,NEG
Spanish,Rome,Chic & Town Luxury Rooms,"La recepcionista muy amable, nos ayudo mucho. 
El tener acceso a tomar café es muy bueno.","Que prestaran servicio de desayuno, sin tener lugar para eso, y enviarte a un lugar bastante complejo de llegar, y al estar ahí no sabes que cosas tienes acceso pedir.
El baño esta mal diseñado ya que la ducha es muy incomoda.",4,NEG
Spanish,Rome,Chic & Town Luxury Rooms,La ubicacion,"El precio , la habitacion pequeña y el olor no muy agradable , el desayuno ni pudimos ir ya que era en una cafeteria a unas cuantas calles del hotel y teniamos que salir a las 7,30 de la mañana y no esataba abierto",6,NEG
Spanish,Rome,Chic & Town Luxury Rooms,"La cama era comodísima. Francesco nos recibió muy amable. El señor de la limpieza también muy amable
Ubicación perfecta.","Para ir a nuestra habitación tienes que acceder por una escalera de servicio, pasando por los cubos de basura. Da una impresión horrible. El ascensor estaba estropeado. No hay un sitio para desayunar. Hay un pequeño sitio en donde hay dos mesas pequeñas con una cafetera Nesspreso (o similar) para tomarte un café o un te, nada mas. En nuestra habitación, la bañera esta dentro de la habitación, pero no hay una ducha donde te puedas duchar. Si o si tienes que pasar por la bañera siendo muy incomodo la ducha medio tumbada para no poner todo perdido. El cuarto de baño es un retrete y un lavabo donde no caben dos personas.",5,NEG
Spanish,Rome,Bloom Hotel Rome,"Es un hotel nuevo, súper cuidado en los detalles. Los recepcionistas muy amables y serviciales.","Las habitaciones son demasiado ruidosas, se escuchaba todo de las habitaciones contiguas. La atención del personal del desayuno, no fue muy amigable",9,POS
Spanish,Rome,Bloom Hotel Rome,"El trato en recepción, restaurante y zonas del hotel fue excelente 👌. Nos dieron muy buenas recomendaciones sobre qué visitar y cómo hacerlo. Se encuentra en una privada por lo que la estadía se siente segura. Los restaurantes cercanos son muy buenos y enfrente hay un supermercado. Llegas muy rápido a la zona del Vaticano para iniciar tus recorridos. El desayuno muy rico y a buen precio. Nos ha encantado!",-,10,POS
Spanish,Rome,Bloom Hotel Rome,"La ubicacion es excelente, esta a 600 mts de vaticano y 300 mts de la estación de tren. 
La gente fue muy amable y nos guiaron cuando teníamos dudas.",La.cama.supletoria es un poco pequeña.,10,POS
Spanish,Rome,Bloom Hotel Rome,"La ubicación es muy buena, ya que estás cerca de todo. Tiene muy cerca una parada de autobús, y el tren que te trae directo del aeropuerto, lo cual es una ventaja increíble. También se puede ir caminando hasta el Vaticano. La zona es residencial, muy tranquila y lejos del ruido. Cuenta con un supermercado en todo el frente y cerca hay farmacias y otros establecimientos. En lo personal, la ubicación es muy buena. El personal también es muy amable y la habitación a pesar de ser pequeña, tiene lo necesario, es moderna, cómoda y muy limpia.","Me gustaría que la habitación tuviese un escritorio un poco más amplio para poder trabajar con el ordenador, ya que el que tiene es muy pequeño e incómodo. También me habría gustado que se incluyera más detalles en el baño como: gorro plástico y crema.",9,POS
Spanish,Rome,Bloom Hotel Rome,"Hotel muy bonito, en un barrio céntrico, el desayuno perfecto.",NADA,9,POS
Spanish,Rome,Bloom Hotel Rome,"la habitacion es muy confortable, buen desayuno!",El hotel se encuentra al final de una calle cerrada y este es el unico acceso de entrada y salida por lo que resultaba un poco incómodo.,10,POS
Spanish,Rome,Bloom Hotel Rome,Ubicación,"Me llevaron a otro lugar distinto, ubicado frente al hotel principal, muy distinto al de los fotos. Por ejemplo, tiene tazas plásticas para el café, las que tienen quemaduras de cigarros dentro.",4,NEG
Spanish,Rome,Bloom Hotel Rome,,Se oia mucho ruido del piso de arriba,6,NEG
Spanish,Rome,Bloom Hotel Rome,Que está a 5 min caminando de unos de los laterales de la Piazza San Pietro,El acceso y la insonorización de las habitaciones.,6,NEG
Spanish,Rome,Bloom Hotel Rome,,"el wc no se correspondía con las fotos anunciadas y era pequeño, antiguo y súper reducido para dos personas, teniamos que hacer turnos para cualquier pequeño uso ya que solo podía entrar una persona.",6,NEG
Spanish,Rome,Bloom Hotel Rome,"muy amable todo el mundo, bien desayuno",no era espectacular pero cumplía.,6,NEG
Spanish,Rome,Bloom Hotel Rome,El desayuno era de muy buena calidad y el personal atento.,"Las toallas y sábanas se guardaban afuera de nuestra habitación y desde temprano en la mañana se escuchaban puertas cerrando y ruido de parte del equipo de housekeeping. No es posible descansar muy bien. 
También la ducha y el lavamanos estaban tapados.",5,NEG
Spanish,Rome,Bloom Hotel Rome,la ubicación,"el desayuno y las habitaciones muy frías, pese a que lo hicimos saber en la recepción",5,NEG
Spanish,Rome,Fauno Urban Resort,"muy buena atención , excelentes habitaciones, muy buena ubicación",,10,POS
Spanish,Rome,Fauno Urban Resort,La cortesía de sus funcionarios,,10,POS
Spanish,Rome,Fauno Urban Resort,Extraordinario servicio del personal en específico de Devora. Gran apoyo hasta después de haber cumplido nuestra estadía. Muchas felicidades.,Mejoraría el aseo de los cuartos. Aunque es bueno.,10,POS
Spanish,Rome,Fauno Urban Resort,"Todo excelente. Ubicado a 10 minutos del Coliseo, caminando. El hotel es precioso y sus instalaciones muy cómodas y limpias.",Creo que la limpieza de la piscina puede mejorar. No siempre se veía bien.,10,POS
Spanish,Rome,Fauno Urban Resort,"El personal muy amable! Llegamos antes y la habitación no estaba lista, pero nos indicaron amablemente que teníamos que esperar un momento y fueron muy rápidos :)
El desayuno estaba rico y muy variado, en un ambiente tranquilo.",,9,POS
Spanish,Rome,Fauno Urban Resort,"Muy cerca del coliseo, personal muy amable",Nunca supe como apagar la luz de la recamara,10,POS
Spanish,Rome,Fauno Urban Resort,Desayuno.,La maneta de la habitación rota. Jabones vacíos. Calefacción automática a alta temperatura. Mesilla de noche rota. Se escucha todo lo de la habitación de al lado.,4,NEG
Spanish,Rome,Fauno Urban Resort,Lugar bien privado trato cordial al lado de metro .,Estuve muy a disgusto por que cambiaron mi habitación... Si reconocieron el error y pagaron la diferencia de una a otra ... Pero mi último día en Italia no fue lo planificado gracias a Fauno...,3,NEG
Spanish,Rome,Fauno Urban Resort,El recinto y la ubicación,La habitación en pleno paso de la entrada al recinto sin poder abrir la única ventana que tenía la habitación. Un zulo de diseño,4,NEG
Spanish,Rome,Fauno Urban Resort,El alojamiento es alucinante. Precioso en pleno centro. La habitación muy cómoda. Te dan toallas y chanclas para la piscina. Súper acogedor. Como estar en un paraíso en la ciudad.,"La habitación 1 en la que nos alojamos tenía una plaga de ciempiés de jardín. Horrible. Lo apreciamos entrada la noche. A la mañana siguiente lo comunicamos y no nos hicieron ni si quiera un descuento. 
No pude dormir en toda la noche.",6,NEG
Spanish,Rome,Fauno Urban Resort,La habitación muy grande.,"La iluminación de las habitaciones , el desayuno y el control de los insectos.
Poco personal",5,NEG
Spanish,Rome,Fauno Urban Resort,"El desayuno. La cama de matrimonio era cómoda.
Buena ducha y calefacción.","Las instalaciones están un poco deterioradas. Se ve mucho más bonito en las fotos de cómo realmente lo tienen.
Para un hotel de este estilo el zumo de naranja debería ser natural no de bote. Los apartamentos tienen una mini cocina pero no tienen nada de menaje ni sartenes. 
Las camas de los niños muy pequeñas.",6,NEG
Spanish,Rome,Fauno Urban Resort,"El lugar muy bonito y la cercania con el coliseo y el metro, la atención también muy buena!","La habitación tiene una luz que se enciende por movimiento justo al lado de la cama y si te mueves por la noche durmiendo se enciende sola y es muy molesto. El baño tiene una luz led que no se apaga y no tiene privacidad, al bañarse se pasa el agua dentro de la habitación porque no está totalmente cerrado el vidrio que tiene puesto la ducha y se nos ha inundado. Por la noche el agua ha salido caliente pero por la mañana no me he podido bañar porque estaba fría completamente.",5,NEG
Spanish,Seoul,Hotel Skypark Myeongdong 1,"El personal muy amable,la limpieza y la ubicación,genial prácticamente al lado de una boca de metro,lleno de restaurantes,todo tipo de tiendas,puestos callejeros. ..","El desayuno buffet.Bastsnte básico,rico,fresco,pero poca variedad.Como fué por cortesía tampoco me atrevo a quejarme mucho.",10,POS
Spanish,Seoul,Hotel Skypark Myeongdong 1,la ubicación,que no tuviera parking. Fue un gran inconveniente ya que teníamos un coche rentado,9,POS
Spanish,Seoul,Hotel Skypark Myeongdong 1,La ubicación y su relación calidad precio.,Que no se pudiera abrir la ventana.,9,POS
Spanish,Seoul,Hotel Skypark Myeongdong 1,"Todo impecable, camas amplias y muy cómodas, la ducha estupenda, buena presión de agua y temperatura.
Fácil de encontrar, muy tranquilo y cerca del mercado y de diferentes puntos turísticos ( ~1km a pie)","El desayuno tiene poca variedad para lo que suele ser habitual en un hotel.
Poca fruta (solamente plátano y pomelo). Un único tipo de zumo, de naranja.",9,POS
Spanish,Seoul,Hotel Skypark Myeongdong 1,La atención y el desayuno geniales,Faltaría una mesa o un guardarropas más. Es muy pequeño y todo lo tenía en el suelo. Gracias,9,POS
Spanish,Seoul,Hotel Skypark Myeongdong 1,"ubicación espectacular y perfecto si viajas solo, la habitación es un poco pequeña si es que vas con más de una persona, el desayuno estaba preciso, estilo western y no con muchas opciones pero es suficiente.","Las habitaciones son un poco pequeñas, y no hay espacio si es que vas con más de una maleta. El hotel estaba limpio y la habitación también, el único problema fue que al momento de tomar una de las batas que dejan en la habitación, no la pude usar debido a que por dentro tenía cabello. Me imagino que las lavan todas juntas, y no se veía sucia, pero esta vez les falto revisar.",9,POS
Spanish,Seoul,Hotel Skypark Myeongdong 1,La ubicación es lo único positivo. Desayuno incluido sin contratarlo de 7-9. Nos dejaron hacer checking antes de tiempo. Se agradece.,"Teníamos una habitación para 3 sin ventana, sin saberlo . Por supuesto que habríamos cogido otro hotel o habitación. Es pequeña e incómoda, sin muebles ni espacio para las maletas. 
Hay hoteles en la zona de similares precios y mejores habitaciones. Nosotros decidimos cambiarnos.",3,NEG
Spanish,Seoul,Hotel Skypark Myeongdong 1,"Lo positivo: 
- La ubicación es lo mejor y lo más rescatable, si vas a pasear, quédate ahí, está en medio de la calle con más vida de Myeongdong, cerca a estaciones de subway, restaurantes, tiendas de todo, comida callejera y más. Si vas en plan paseo y shopping es buena opción, si eres claustrofóbico no.
- Siempre dejaban todo limpio.","Lo malo: 
-La gente que trabaja ahí es un poco hostil. 
- El cuarto de hotel más pequeño en el que he estado, no había espacio ni para abrir la maleta en el piso. Literal la cama entre dos paredes, un escritorio pequeño con una tv que parecía monitor de pc… 
- si llegas antes te dejan hacer early check in a cambio de una reseña de 5 estrellas en trip advisor, prácticamente me quitaron el teléfono de la mano para ellos ponerse 5 estrellas en todo, cuando yo no había visto ni el cuarto, ni salido del lobby, fue bastante raro.
- El desayuno es gratis, cero variado, pocas opciones, pero está ok… lo que nos sorprendió fue que fuera de 7 a 9… uno de los días bajé como a las 8:30am a desayunar, tuve que esperar turno y cuando dieron las 9, fueron mesa a mesa a pedirnos que nos fueramos!!!!! Todos en shock, no importaba si te acababas de sentar, querian que te vayas. Jamás me pasó algo así en ningún país, ni en ningún hotel.",4,NEG
Spanish,Seoul,Hotel Skypark Myeongdong 1,Lo mejor la ubicación.,"Habitaciones muy pequeñas. Buffet del desayuno muy limitado. No nos dejaron hacer el check in hasta las 15:00, ni un minuto antes.",6,NEG
Spanish,Seoul,Hotel Skypark Myeongdong 1,Ubicación perfecta,Si viajas con equipaje grande prácticamente no podrás moverte dentro de la habitación,5,NEG
Spanish,Seoul,Seoul N Hotel Dongdaemun,"Todo muy bien, el desayuno con variedad y la ubicación. Por 1000 W puedes hacer lavadoras y por otros 1000W secadora. Zona amplia para hacer colada y tomar café mientras esperas. Los trabajadores muy amables y atentos",,10,POS
Spanish,Seoul,Seoul N Hotel Dongdaemun,"Hotel bien ubicado, a 200 metros de una parada de metro línea 1 y 6 (Dogmyo). Buenos desayunos todos los días, variedad de empanadillas, salchichas y a veces ensalada de col, arroz o pasta, de fruta plátanos y rebanadas de pan con mantequilla y mermelada, cereales. Variedad buena",Las toallas para ducharse son toallas de lavabo así que los que no están acostumbrados mejor traerse toalla de dicha con uno en equipaje,9,POS
Spanish,Seoul,Seoul N Hotel Dongdaemun,"La zona común de cocina, lavadora,comedor, la ubicación y sobre todo la terraza de arriba que tiene unas vistas maravillosas. El dueño del alojamiento se portó muy bien con nosotras y nos ofreció una habitación cuando por error había reservado otra cosa. Él es una persona muy amable y agradable con todo el mundo y le estamos muy agradecidas.",Que no limpian las papeleras durante la estancia. Si estás muchos días se acumula basura y necesitaría que se limpiara la habitación algún día para largas estancias,9,POS
Spanish,Seoul,Seoul N Hotel Dongdaemun,"Muy cómodo, exelente servicio",Duraraban días en limpiar el cuarto,10,POS
Spanish,Seoul,Seoul N Hotel Dongdaemun,buena ubicación,"desayuno pésimo , atención al cliente regular",4,NEG
Spanish,Seoul,Seoul N Hotel Dongdaemun,Nada,"El desayuno pobre ,de hecho solo fuimos el primer día , las hab pequeñas ,los baños divididos de la hab x un vidrio.",6,NEG
Spanish,Seoul,Seoul N Hotel Dongdaemun,La ubicación y la variedad de comida del desayuno,"Las camas tenían un plástico debajo de las sábanas que hacían que sudaramos mucho, camas muy duras.
Habitación muy pequeña.
El baño situado en frente de la cama, con una puerta de cristal donde se distinguía todo.",5,NEG
Spanish,Seoul,Seoul N Hotel Dongdaemun,"Limpio, la ubicación es buena, el personal muy amable","Todo tiene un depósito, un adaptador y una tarjeta extra y no siempre sales con tu acompañante, la puerta de cristal en el baño no te da ninguna privacidad es bastante incómodo...",8,POS
Spanish,Seoul,Seoul N Hotel Dongdaemun,"La ubicación buena, se podía acceder a metro y bus muy facilmente, así como también a locales comerciales. Buen desayuno.","El espacio de la habitación demasiado pequeña, no tenía lugar para guardar cosas y las puertas tanto del baño como de la ducha se traslucía todo para afuera.",7,POS
Spanish,Seoul,Hotel Skypark Dongdaemun I,"Me encantó desde el primer momento que llegué por que tuve problemas con la tarjeta de crédito y a un así me dejaron dormir y pagar el siguiente día cuando podía cambiar en efectivo.Si no fuera por su amabilidad ,podría haberme quedado en la calle por era de noche.
Las habitaciones limpias,los empleados mui educados.
Además,después de los 5 días reservados,e decidió quedarme 16 días más sin cambiar a otro hotel.
Volveré el próximo año din duda",Me gustó todo,10,POS
Spanish,Seoul,Hotel Skypark Dongdaemun I,La buena comunicacion del hotel hacia el centro,Que no habia mucha variedad en el desayuno,10,POS
Spanish,Seoul,Hotel Skypark Dongdaemun I,"Es lindo el cuarto, tiene buen tamaño, ofrece todo lo que un hotel puede brindar y tiene una parada del airport bus cerca.
El personal es amable y servicial.
Saludos",,10,POS
Spanish,Seoul,Hotel Skypark Dongdaemun I,"Me gusto todo no tengo ninguna opinión negativa, muchas gracias por su atención el staff fue de 10...",,10,POS
Spanish,Seoul,Hotel Skypark Dongdaemun I,todo,Podrían tener una máquina de café,10,POS
Spanish,Seoul,Hotel Skypark Dongdaemun I,Ubicación estaba muy bien,"Estuvimos 3:noches y una de las veces nos hicieron subir por el ascensor de servicio, donde estaban las bolsas de la ropa sucia para dar una mejor atención a un grupo de turistas chinos. El almuerzo es muy justo, te tienes que retirar tu la mesa. Y nos dieron un habitación donde la ventana daba a una pared y no se veía nada, era como si no hubiese.",6,NEG
Spanish,Seoul,Hotel Skypark Dongdaemun I,Ubicación,Calidad percibida,6,NEG
Spanish,Seoul,Hotel Skypark Dongdaemun I,"La ubicación, al estar cerca de Dongdaemun y Eujiro te da muchas posibilidades de ver la ciudad",Algún empleado de recepción fue muy borde con nosotros.,5,NEG
Spanish,Seoul,Hotel Skypark Dongdaemun I,Limpio y amplio. Buena localización. El proceso de check-in y check-out es a través de una máquina disponible en la planta de recepción.,"La cerradura de la puerta de la habitación funciona a través de un código, siendo algo confuso de usar. La luz de la entrada se enciende con un sensor de movimiento y no se puede desconectar. Todo lo demás funciona bastante bien.",8,POS
Spanish,Seoul,Travelodge Myeongdong Euljiro,"Un hotel muy lindo con una ubicación muy conveniente, habitaciones amplias, limpias",Todo muy bien,10,POS
