Language,City Name,Hotel Name,Upside_Review,Downside_Review,Review_Score,Sentiment
Spanish,New Delhi,Shangri-La Eros New Delhi,"Las instalaciones, el personal súper atento",Los restaurantes ( hay 3) son muy caros en proporción al precio de las habitaciones y al coste del país. Además en los restaurantes a la carta especialmente el Sorrento son mu lentos. Una hora desde que pides para que te llegue la comida.,6,NEG
Spanish,New Delhi,Shangri-La Eros New Delhi,bonito hotel bonita habitación y buena ubicación,"los botones de las maletas muy mal .
el restaurante súper caro y siempre con la terraza cerrada por eventos privados y yo pago un paston por cenar y tengo que cenar encerrado",5,NEG
Spanish,New Delhi,Shangri-La Eros New Delhi,el hotel se encuentra bien ubicado y tiene lindos jardines. Linda vista de la habitación. La piscina es cómoda y la habitación tiene buen tamaño.,"el desayuno poco variado. Es decir, había mucha variedad pero si te gusta la comida india. Para mi, era demasiado y me faltó variedad en el desayuna más tipo continental. Los restaurantes eran buenos pero excesivamente caros para el precio del hotel y no hay lugares cercanos a donde ir por lo que te ves un poco obligado a quedarte ahí. Se les entiende poco el inglés.",6,NEG
Spanish,New Delhi,Shangri-La Eros New Delhi,su ubicación,"pues después de cancelarnos dos vuelos llegar molidos , nos cobran media estancia de ese día pir llegar antes de la reserva pero eran las 6:30 de la mañana y dijeron. que no podían darnos la habitación hasta las 7:30. así tratan a clientes asiduos de muchos años y muchas estancias .",1,NEG
Spanish,New Delhi,Shangri-La Eros New Delhi,"Engañan al cliente ! En sus restaurantes , ponen ingredientes en la carta que no tienen. La carta del italiano refleja que tienen pizzas de jamón de Parma y prosciutto y luego ponen una especie de chopped asqueroso . Una vez devuelto el plato , el cocinero nos dice que eso es lo que se utiliza en Italia , que nunca han tenido prosciuto , que ponen eso en su lugar , sin embargo, sí lo publicitan en la carta . No es propio de un Hotel de esta categoría. No nos habían limpiado la habitación, regresamos de estar todo el día por la calurosas calles de Delhi por la tarde y el cuarto estaba igual que lo dejamos.",Engañan al cliente!,1,NEG
Spanish,New Delhi,Shangri-La Eros New Delhi,Nada,"Me robaron la Targeta de crédito , se me callo al suelo junto al taxi y solo estaba el chico de las maletas , nada ni nadie mas , y la Targeta desapareció .",1,NEG
Spanish,New Delhi,Grand Hari Piorko,El baño y la ubicación. La comida muy buena.,La almohada y el wifi a veces se cortaba.,9,POS
Spanish,New Delhi,Grand Hari Piorko,"Muy buen hotel calidad precio , limpio y grande rn main rout de pajarghan, con agencia de viaje .., un buen cafe..buena pizza..con guarda maletas y sobre todo muy buena atencion..tengo que darles las gracia directamente a BABLU POR SU AMABILIDAD Y SOPORTE ..GRACIAS HARI PIORKO",No tengo ninguna queja solo daros las gracias,10,POS
Spanish,New Delhi,Grand Hari Piorko,La ubicación. En pleno corazón Main Bazaar.,"Habitación con humedad, sábanas sucias con manchas y muchísimo ruido.",6,NEG
Spanish,New Delhi,Grand Hari Piorko,"Para quien quiere estar en una zona que NO es tranquila, es un hotel muy sencillo pero bien.
Es main bazar.
El personal de recepcion, MUY amable.",,6,NEG
Spanish,New Delhi,Grand Hari Piorko,El cuarto era amplio,"La zona es un basurero, el baño no estaba limpio, el personal del hotel fue descortés, el check i'm fue bastante demorado",6,NEG
Spanish,New Delhi,Grand Hari Piorko,La chica que me antendió durante el check in,Taxi reservado con 5h de antelación que llega 35minutos tarde.,5,NEG
Spanish,New Delhi,Grand Hari Piorko,La cama era cómoda y las instalaciones estaban bien. Buena ubicación.,"Había cucarachas por todas partes, que no sabíamos de donde salían. Pedimos agua caliente y nos vino un chico con un cubo enorme con el agua calentada, cuando esperábamos que saliese del grifo caliente.",6,NEG
Spanish,New Delhi,Grand Hari Piorko,Ubicación,Falta mantenimiento y limpieza,5,NEG
Spanish,New Delhi,Grand Hari Piorko,"Personal amable y servicial, dentro de Paharganj bastante bien.","La habitación no tiene ventanas (oscura) . Y la ropa de cama no olía del todo bien. Las toallas y ropa de cama alto desgastadas y viejas.
El hervidor funciona pero la tapa estaba rota . La ducha (el mono mando) se filtraba.",8,POS
Spanish,New Delhi,Grand Hari Piorko,Ubicación,Habitación muy pequeña y no había agua caliente,7,POS
Spanish,New Delhi,bloomrooms @ Janpath,"El desayuno es muy completo, es un hotel moderno, recomendable.",,9,POS
Spanish,New Delhi,bloomrooms @ Janpath,la habitacion tamaño ideal. las camas comodas. el desayuno excelente. el servicio de transporte y turismo del hotel excelente. nos consiguieron guia en español.la comida a la habitacion muy rica y abundante,nada,9,POS
Spanish,New Delhi,bloomrooms @ Janpath,la ubicación era muy buena y tienen servicio de turismo en el hotel que hemos contratado para movernos y maravilloso,el desayuno no es internacional. no es muy variado y todo es picante que para los europeos es difícil de tolerar,9,POS
Spanish,New Delhi,bloomrooms @ Janpath,ubicación,el café del desayuno,9,POS
Spanish,New Delhi,bloomrooms @ Janpath,,Las zonas de la recepción muy cálidas. La lentitud del servicio de cocina,9,POS
Spanish,New Delhi,bloomrooms @ Janpath,"hotel limpio para la India. con habitaciones amplias. el desayuno muy limitado, pero con lo esencial para pasar el día. 
los snacks que ofrecían de cortesía, no se pueden comer, son todos especialmente picantes, pero se agradece el agua caliente y el té que queda a disposición en el pasillo. .","el hotel queda en una zona no muy linda para recorrer, pero con transporte igualmente se llegaba bien. 
el personal del hotel no es muy amable, el último día al pagar en efectivo los consumos se negaban a entregarme el cambio esgrimiendo que no tenían suficiente dinero para devolverme, cosa extraña para un hotel. Al final de la discusión optaron por ir a cambiar y entregarme lo que correspondía.",6,NEG
Spanish,New Delhi,bloomrooms @ Janpath,"La ubicación, limpieza y habitación.","El personal es muy desagradable y antipático, nada predispuesto a ayudar. Le preguntamos por indicaciones y nos señaló un mapa que tienen en la pared. Le pedimos cambio de dinero por billetes más pequeños y nos dio un no rotundo. El desayuno es pobre además nadie te explica qué puedes pedir o que incluye. La habitación era muy ruidosa, se escuchaban a los demás clientes ya que estaba al lado de la sala de estar. Intentamos contactar con ellos en varias ocasiones antes de llegar y fue imposible, nunca recibimos respuesta por su parte.",5,NEG
Spanish,New Delhi,bloomrooms @ Janpath,Tenía servio compartido de mini bar en cada piso con dispenser de agua fría y caliente. Buena ubicación,"La habitación era muy chica y la cama estaba contra una pared, las sabanas rotas, las paredes son de papel, se escuchaba todo lo que hacían y decían la habitación de al lado.",5,NEG
Spanish,New Delhi,bloomrooms @ Janpath,Ubicación,Esperaba más por el precio que cobran.,6,NEG
Spanish,New Delhi,bloomrooms @ Janpath,"Hotel práctico y bien situado para moverse por Delhi.
Las habitaciones son básicas y cómodas. Mención especial las zonas comunes y la zona de desayuno, muy bien decoradas y agradables.",-,6,NEG
Spanish,New Delhi,FabHotel White Klove Paharganj,La habitación estaba muy limpia y cómoda y está muy cerca del main bazaar,,9,POS
Spanish,New Delhi,FabHotel White Klove Paharganj,Céntrico.,"Sucio e incómodo. No es igual que las fotos!!!
Colchones deformados y viejos, muy incómodos. 
Restaurante de dudosa higiene..
Barrio ruidoso y sucio, la calle huele a pis y basura.
No lo recomendaria.",3,NEG
Spanish,New Delhi,FabHotel White Klove Paharganj,,"Las instalaciones son muy viejas y descuidadas nada parecido a las imágenes que muestran. 
Nuestro baño se inundaba constantemente. 
En la cafetería estaban las cucarachas y a pesar de avisé al personal, no hicieron nada al respecto.",3,NEG
Spanish,New Delhi,FabHotel White Klove Paharganj,La ubicación,"Habitación ubicada cerca de un transformador, se odia mucho ruido en la habitación. El aire acondicionado no funcionaba",4,NEG
Spanish,New Delhi,FabHotel White Klove Paharganj,la ubicación cercana al metro,Que me quisieron cobrar 300 rupias cuando pedí una frazada porque en la habitación hacía frío y vi una cucaracha grande en la bacha y dos Chicas en el baño. la ducha no salía con poquita agua y el agua caliente se cortó rápido.,5,NEG
Spanish,New Delhi,FabHotel White Klove Paharganj,"Nada porque tenía la reserva confirmada en booking y cuando llegué al hotel pues no había ninguna reserva a mi nombre y me dijeron que no podian hacer nada porque no tenían disponibilidad, tuve que ir a buscar otro hotel en plan tirados en el centro de Delhi, Fatal todo la verdad",,1,NEG
Spanish,New Delhi,CASA CENTRAL,"El lugar, la amabilidad y el precio",Nada,10,POS
Spanish,New Delhi,CASA CENTRAL,Un oasis en el caos de Delhi! Muy limpio y buen desayuno! Recomendable,Todo bien,10,POS
Spanish,New Delhi,CASA CENTRAL,El staff,Falta de enchufes en la habitación y una silla,10,POS
Spanish,New Delhi,CASA CENTRAL,"Nos dieron una habitación más grande que la que habíamos contratado que tenía dos baños. En cuanto a la limpieza, estaba todo limpio. Y la localización perfecta en una calle llena de tiendas que aprovechamos para comprar los últimos días. Sin duda si volviera a Nueva Delhi me quedaría aquí. Ya que es muy barato y está genial. Hubo otro día que nos quedamos en Delhi en otro alojamiento más caro y este estaba mejor.",Nada,10,POS
Spanish,New Delhi,CASA CENTRAL,"Fue nuestro último alojamiento del viaje a India y bajo nuestro opinión el mejor calidad-precio. Sitio limpio y con un personal muy amable. La ubicación es muy buena para hacer unas últimas compras antes de volver a casa, ya que se encuentra en pleno main bazar y los precios en esta zona son mejores para turistas que en otras partes de la india.","Se encuentra poco visible y a nuestro conductor le costó un poco encontrarlo, pero desde el hotel el personal salió a recibirnos donde estábamos, con lo cual este problema fue totalmente resuelto.",9,POS
Spanish,New Delhi,CASA CENTRAL,Personal,"Alojamiento sucio, habitación pequeña, baño con humedad",3,NEG
Spanish,New Delhi,CASA CENTRAL,"La ubicación. 
La habitación no está mal para pasar unos días",Al llegar nos dio muy mala sensación. Un chico durmiendo en el suelo en medio de la recepción.,4,NEG
Spanish,New Delhi,CASA CENTRAL,La amabilidad del propietario y del personal,La falta de limpieza en las habitaciones. Sabanas y toallas sucias. Colchon muy duro. Nuestra habitacion disponia de dos baños y no se sabia cual estaba mas sucio. El edificio y las habitaciones estan reformadas de hace poco y el polvo todavia se puede ver en todos los muebles.,4,NEG
Spanish,New Delhi,CASA CENTRAL,El tamaño de la habitación y la cama,"El dueño o señor que regentaba el hotel. Era un cotilla y parecía un poco timador. Todo el rato preguntando q ibas hacer, si tenias contratado chofer o no, etc...",6,NEG
Spanish,New Delhi,The Grand Uddhav,"Ubicación, habitación top y personal excelente","Nada, todo perfecto",10,POS
Spanish,New Delhi,The Grand Uddhav,"Es un alojamiento perfcto para pasar unos dias en New Delhi, muy acojedor y agradable. Tranquilo y respetuoso. Muy contento, lo recomindo!",,10,POS
Spanish,New Delhi,The Grand Uddhav,"totalidad , limpieza muy acogedor",conforme,10,POS
Spanish,New Delhi,The Grand Uddhav,"Las camas son cómodas y la ubicación si quieres
sentirte en la India perfecto. Personal amable. Puedes
cenar arriba en terraza y la comida no está mal, pero 
a su ritmo.","Las fotos no son la realidad. Lavabo bastante sucio, 
y tienes que pedir papel wc, entiendo porque ellos no 
utilizan, pero un 4 estrellas no es. Desayuno no muy 
bueno. Las instalaciones viejas. Pienso no es un hotel 
para gente occidental",4,NEG
Spanish,New Delhi,The Grand Uddhav,Cerca del alojamiento hay roof top interesantes y un mercado donde poder pasear y hacer compras,"Desde que llegamos a las 0:30 am nos empezaron a atosigar con preguntas de si queríamos cerveza, cenar, lavandería (que resultó CARÍSIMA). Cada vez que entrábamos por la puerta del hotel eran las mismas preguntas. En un momento, uno de los chicos entró en mi habitación sin permiso mientras yo estaba en el baño.
A la hora de irnos tanto a mi pareja como a mi nos persiguieron para que devolviéramos las llaves cuando ya las habíamos entregado a otro chico. Además encargamos un taxi al aeropuerto que decían que no habíamos pagado, cosa que se hizo en el momento de la reserva.
Nos alojamos en una suite “superior” pero de superior no tenia NADA",5,NEG
Spanish,New Delhi,The Grand Uddhav,Muy buena ubicación y comodidad en el hotel,,8,POS
Spanish,New Delhi,The Grand Uddhav,tranquilo y limpio,me pareció algo caro en relación a los costos de india,7,POS
Spanish,New Delhi,The Grand Uddhav,nada,"la ubicación es pésima, es barrio no es bueno. El wifi no funciona, dicen tener agua caliente, pero no es verdad.
La pieza tiene ventanas, pero están tapadas con un panel que no deja entrar luz natural.
y por último, comimos un día de su restaurant, a las 2 horas me comienzo a sentir mal y me tuvieron que hospitalizar por intoxicación.",2,NEG
Spanish,New Delhi,The Grand Uddhav,Nada,"La habitacion estaba sucia. El agua caliente solo estaba disponible durante unas horas, creo que deberian ponerlo al hacer la reserva. El chico que nos dio la habitacion no hablaba practicamente ingles y no nos supo decir como iba el desayuno, no obstante, ni lo probamos ya que por las pintas de todo preferimos no arriesgar. Lo peor de todo llego cuando al irnos la chica de recepción me pidio que le abriera la app de booking en mi movil para chequear unos datos de la reserva y lo que hizo fue puntuar mi estancia en el hotel con un 10, por supuesto, borre el comentario. Jamas volveria a este hotel.
La zona del hotel es dentro del gran bazar, llegamos de noche y daba miedo, con prostibulos justo al final de la calle.",2,NEG
Spanish,New Delhi,The Park New Delhi,La ubicación es perfecta cerca de todo.,No se si es problema permanente de allá. ... pero el agua de la labavo ducha e hinodoro eran cafes. El tamaño de mi ducha era demasiado pequeña apenas cabía yo y el agua daba directo a la pared de lo pequeño.,9,POS
Spanish,New Delhi,The Park New Delhi,Nos hicieron un upgrade gratuito para que estuviéramos más confortables,,9,POS
Spanish,New Delhi,The Park New Delhi,La ubicación es correcta,"No corresponde a la
categoría que tiene. Está muy antiguo y mal cuidado.",4,NEG
Spanish,New Delhi,The Park New Delhi,"solo el lobby, por que después Nos dieron una habitación muy mala, al siguiente día nos cambiaron por otra mejor","los cuartos viejos, toallas viajas, cortinas sucias,cojines sucias, porta jabón de ducha oxidado, grifos oxidados,colchón viejo y hundido.
cuartos pequeños",3,NEG
Spanish,New Delhi,The Park New Delhi,"Para ser un hotel de cinco estrellas, es bastante deficiente","Suciedad y sensación de viejo, personal poco amigable",6,NEG
Spanish,New Delhi,The Park New Delhi,el servicio de masajes,"el ruido por los
pasillos, y que no me limpiaron el lavabo ni la ducha. las fotos no se ajustan al alojamiento",6,NEG
Spanish,New Delhi,The Park New Delhi,"la ubicación,la limpieza, y el desayuno",no tengo ningún comentario negativo que realizar.,8,POS
Spanish,New Delhi,The Park New Delhi,el desayuno buffet y la ubicación,la falta de limpieza en los baños y las alfombras… olía un poco mal,8,POS
Spanish,New Delhi,The Park New Delhi,"Situación, la habitación era cómoda,","El desayuno , la piscina cerrada, las bebidas en el bar muy caras",8,POS
Spanish,New Delhi,Hotel Cottage Yes Please Near New Delhi Railway Station,La ubicación,"Todo bien, por el precio está bien",9,POS
Spanish,New Delhi,Hotel Cottage Yes Please Near New Delhi Railway Station,"Un chico del personal, Priat, creo que es su nombre. Se portó muy bien.","El desayuno es otro lugar y muy escaso, cuando llegué no había agua caliente para ducharse y el resto de los días tenia que avisar para que la activaran. La ducha parece que se cae. Por último me quisieron cobrar dos veces porque el señor de recepción no sabia comprobar que estaba pagado con tarjeta desde el primer día.",3,NEG
Spanish,New Delhi,Hotel Cottage Yes Please Near New Delhi Railway Station,,"Las sabanas super sucias,el baño sucio y olia fatal.
Solo me quede 1 noche,me cambie de hotel",3,NEG
Spanish,New Delhi,Hotel Cottage Yes Please Near New Delhi Railway Station,El trato del personal y las camas cómodas.,"A pesar de estar en India, país de los olores según mi experiencia, la habitación olía a combustible no se por qué.
Además está muy mal insonorizado.",6,NEG
Spanish,New Delhi,Hotel Cottage Yes Please Near New Delhi Railway Station,"De sobra por el precio!!! He venido más de 100 veces a este hotel, mismos dueños, personal. Seguro y cumple con lo esencial.","Nada que decir, tal vez el baño puede mejorar un poco pero para eso pagas mas y punto en otro lado. Es un regalo.",8,POS
Spanish,New Delhi,Hotel Cottage Yes Please Near New Delhi Railway Station,El personal fue muy amable y las instalaciones estaban bastante bien.,,8,POS
Spanish,New Delhi,Hotel Cottage Yes Please Near New Delhi Railway Station,accesibilidad,poca limpieza,7,POS
Spanish,New Delhi,Hotel Cottage Yes Please Near New Delhi Railway Station,Nada,"Huir de aquí!! El peor hotel que he estado en mi vida, no funcionaba nada los enchufes estaban quemados no pude cargar mi teléfono nunca, reclame y me ignoraron que irían a ver y nunca iban la habitación no tenía wifi, la regadera no servía, El personal incompetente completamente y bastante mal educados",1,NEG
Spanish,Paris,Hotel Eiffel Seine,"La ubicación, muy cerca de la Torre Eiffel. El barrio muy colorido. El personal impecable.",No hay nada que reclamar.,10,POS
Spanish,Paris,Hotel Eiffel Seine,La ubicación es perfecta. Justo a un lado del metro y muy cerca de la Torre Eiffel. La atención del personal en recepción fue muy amable. Encantados con ellos. Nos hicieron el amable favor de cuidar nuestras maletas. El desayuno también estuvo rico.,"Para ir a nuestra habitación debíamos pasar por un pequeño patio sin techo y en una ocasión nos tocó lluvia. Además, la regadera no tiene puerta por lo que se salía el agua.",9,POS
Spanish,Paris,Hotel Eiffel Seine,La ubicación y buena atención,Servicio desayuno,9,POS
Spanish,Paris,Hotel Eiffel Seine,"La ubicación es excepcional, y el personal estupendo. 
Super bien predispuesto, y muy atento.
Las habitaciones eran muy bonitas y las camas cómodas.","La habitación muy pequeña, y un tanto incómoda para moverse. 
El baño también pequeño, así como los pasillos.",9,POS
Spanish,Paris,Hotel Eiffel Seine,La ubicación. El desayuno. La atención del personal.,Nada,9,POS
Spanish,Paris,Hotel Eiffel Seine,La ubicación,No cambiaron las toallas en los 5 días que estuvimos.,9,POS
Spanish,Paris,Hotel Eiffel Seine,La ubicación,"Estaba en obras. La entrada empapelada, El ascensor no funcionaba......",3,NEG
Spanish,Paris,Hotel Eiffel Seine,,"El lobby estaba en remodelación, había un fuerte olor a pintura y esto no se nos informó en ningún momento al momento de hacer la reserva",4,NEG
Spanish,Paris,Hotel Eiffel Seine,La ubicación cerca de la Torre Eiffel,"Habíamos reservado habitación con vista a la Torre, cuando llegue no tenían ese tipo de habitación, sin reconocer una devolución o descuento por alojarme en otra habitación. Me dicen que el estacionamiento cuesta 25 Euros diarios y me cobran 33 Euros diarios..",4,NEG
Spanish,Paris,Hotel Eiffel Seine,,"La cama tenía resortes salidos, muy incómodas. EL wifi apenas funcionaba, era casi imposible usarlo, el aire acondicionado era fatal! La habitación no enfriaba, el calor era insoportable, sólo dormíamos por cansancio. Nos dijeron que eso era lo que había.",4,NEG
Spanish,Paris,Hotel Eiffel Seine,,No permiten hacer check on hasta las 3 pm.... Aunque se quedan con las maletas en consigna es incómodo.,4,NEG
Spanish,Paris,Hotel Eiffel Seine,me gusto el desayuno y la ubicación.,"no me gusto que 3 veces tuve que bajar para pedir toalla, el personal se olvidaban de poner después de limpiar.",3,NEG
Spanish,Paris,Hotel Eiffel Seine,solo la ubicación,la alfombra estaba muy descuidada,4,NEG
Spanish,Paris,Au Pacific Hotel,La ambilidad de la recepcionista Sophie,,10,POS
Spanish,Paris,Au Pacific Hotel,Limpieza,Retirado un poco del área turística,9,POS
Spanish,Paris,Au Pacific Hotel,"Muy buena ubicación para ir caminando hasta la Torre.
Cercano al metro, café, panaderías y otros servicios.
Nos bajamos del metro y en 6 minutos llegamos.",,9,POS
Spanish,Paris,Au Pacific Hotel,"La ubicación es excelente, la calle es muy tranquila y el personal es muy atento, para nosotros fue lo mejor la atención que obtuvimos, nos ayudaron a organizarnos las visitas y nos reservaron un taxi para la vuelta.",Una de las habitaciones era un poco calurosa.,9,POS
Spanish,Paris,Au Pacific Hotel,"El personal muy atento, llegamos temprano y nos dieron una habitación unas 3 horas antes de la hora del chek in porque tenían disponibilidad.
La ubicación y el barrio muy bueno, estábamos cerca de la Torre Eiffel y de estaciones de metro y tren lo que nos facilito los traslados.",,9,POS
Spanish,Paris,Au Pacific Hotel,"Las camas muy cómodas,la chica d la recepción super amable(no m acuerdo del nombre).
Buen desayuno",,9,POS
Spanish,Paris,Au Pacific Hotel,Está muy céntrico,NO TIENE AIRE ACONDICIONADO,4,NEG
Spanish,Paris,Au Pacific Hotel,Rápido el check in,Para el precio que pagué por la habitación fue una decepción. Mucho ruido por la noche y no hay aire acondicionado. Nos dejaron un ventilador pequeño pero con eso no era suficiente.,4,NEG
Spanish,Paris,Au Pacific Hotel,El desayuno bien,"Me sentí engañado por qué las fotos que muestra en el anuncio nada tienen que ver con lo que nos encontramos. Nos ensenaron la habitación y era pequeña, muy antigua y el baño un horror . Todo muy viejo. Al ver nuestro enfadó nos cambiaron la habitación y ésta era diferente. Más espaciosa, limpia y moderna. Al igual que el baño. No se puede consentir que nos quieran engañar mostrando algo diferente. No aconsejo para nada este hotel.",4,NEG
Spanish,Paris,Au Pacific Hotel,La cercanía a la Torre Eiffel (10 minutos caminando),"El cuarto que nos dieron más parecía un depósito de limpieza con una cama (super incomoda). No tenía ventanas a la calle, por lo que era caliente y hacía demasiado calor.
El baño era pequeñisimo y estaba un poco sucio. La ducha era tan pequeña que con las justas podías jabonarte dentro.
Sabían que eramos 2 personas y solo nos dieron 1 toalla, aunque cuando pedimos otra nos la dieron sin problemas.",4,NEG
Spanish,Paris,Au Pacific Hotel,"locación conveniente cerca de champ du mars, céntrico, seguro","pésima atención en desk, no aceptan pago con tarjeta digital o inalámbrica, el personal no es amigable",3,NEG
Spanish,Paris,Au Pacific Hotel,"La persona encargada muy maja, no nos puso pegas al cancelar la habitación.",La habitación que nos dieron no se correspondía con ninguna de la de las fotos. Era horrible.,3,NEG
Spanish,Paris,Au Pacific Hotel,"the place was close to the Eiffel Tower 
el lugar estaba cerca de la torre Eiffel","don’t have air conditioner just a fan and it’s very small for two peoples.
 the elevator only for two people 
no tiene aire acondicionado, solo un ventilador y es muy pequeño para dos personas 
el elevador sólo caben dos personas",3,NEG
Spanish,Paris,Hôtel Aston,"cómodo, limpio , interior diseño moderno y muy buena ubicación",no hubo nada que no me gustara,9,POS
Spanish,Paris,Hôtel Aston,Hotel muy bonito por dentro y por fuera. El personal siempre muy amable y todo muy limpio. En la esquina hay un restaurante de crepas buenísimo!!,La habitación era pequeña pero para los pocos días que estuvimos no hubo problema.,9,POS
Spanish,Paris,Hôtel Aston,Todo me pareció muy bien. Excelente trato del personal y el metro a una cuadra conecta con toda la ciudad.,La habitación podría ser demasiado pequeña para algunas personas.,9,POS
Spanish,Paris,Hôtel Aston,"Excelente ubicación, cerca del metro y restaurantes, se puede caminar hasta Ópera y otros sitios de interés; el personal muy amable, uno de los recepcionistas habla español y el otro se esfuerza… el hotel muy parisino e icónico; la limpieza muy buena; queda en una calle donde hay hoteles similares; volvería sin duda.","Pues un poco pequeños los espacios, el ascensor por su tamaño se vuelve incómodo, ya que sólo caben 2 personas; sin embargo lo pequeño lo hace bohemio; nada que pueda desmejorar la calidad del hotel.",9,POS
Spanish,Paris,Hôtel Aston,La localización es excelente.,Un poco pequeña la habitación,9,POS
Spanish,Paris,Hôtel Aston,Ubicación muy buena y fácil acceso a transportes,La cama doble era muy pequeña,9,POS
Spanish,Paris,Hôtel Aston,"La ubicación, en el centro de París, pero el acceso es un callejón con gente durmiendo en el piso.
Nada más","Desayuno pobre en un sótano sin ventanas.
Cuando llegué a las 19 hs. me entregaron la habitación con un plomero en el baño, no me querían cambiar de habitación, después de varios reclamos accedieron a cambiar.
La habitación muy pequeña, imposible abrir una maleta; el baño, un pasillo de 70 cm. de ancho; los pasillos y escaleras, muy angostos, imposible cruzarse con otra persona.",4,NEG
Spanish,Paris,Hôtel Aston,la ubicacion,Las sabanas estaban manchadas…,4,NEG
